ID,Ingredients,Cuisine
1351,"onion, salt, green chili, cooking oil, Garam Masala, urad dal, ginger garlic paste, mango powder, red chili powder, turmeric powder, asafetida",Indian
1352,"kosher salt, ground coriander, oil, fresh cilantro, ground cumin, garlic, butter, yogurt, Garam Masala, smoked paprika, garlic naan, tomato sauce, coconut milk, cayenne pepper, ginger, medium onion, basmati rice, ground tumeric, boneless, skinless chicken breasts",Indian
1353,"kasuri methi, salt, salt, butter, tomato puree, chicken, cloves, ginger, chilli, turmeric, greek yogurt, green cardamom, cinnamon stick, cream, chopped onion, Garam Masala",Indian
1354,"lavender flowers, almonds, ghee, silver, white bread, milk, saffron, cardamom powder, silver, pistachios, sugar, sugar, milk, pomegranate molasses, saffron, rose, cardamom powder",Indian
1355,"oil spray, coriander powder, lemon juice, olive oil, fish fillet, red food coloring, cumin powder, red chili powder, ginger paste, chili powder, cinnamon powder, plain yogurt, cumin powder, medium onion, nutmeg, fresh lemon juice, garlic paste, salt, mango powder, turmeric",Indian
1356,"fresh lime juice, full fat coconut milk, Garam Masala, onion powder, tomato sauce, ground ginger, fine sea salt, garlic powder, boneless, skinless chicken thighs, fresh chopped cilantro, ground cumin, ground coriander, jalapeno, tomato paste, white rice, red pepper flakes, turmeric powder",Indian
1357,"coriander powder, oil, coriander leaves, garlic paste, mustard seeds, green chillies, rice, onions, methi leaves, ghee, cumin powder, garam masala, curry leaves, tomatoes, chilli powder, salt, turmeric powder",Indian
1358,"garlic, ground coriander, fresh ginger, garlic, white pepper, garam masala, yogurt, tomatoes, turmeric, salt, fresh cilantro, chicken breast, red chili powder, heavy cream, kosher salt, green cardamom pods, tomato paste, onion, ground cumin, ghee",Indian
1359,"chilli powder, turmeric powder, cilantro leaves, cauliflower, oil, Garam Masala, fresh ginger, tomato, ground black pepper, salt, crushed garlic, coriander powder",Indian
1360,"tomato, mung beans, monterey jack, chutney, white sandwich bread, salted butter",Indian
1361,"parsley, extra firm tofu, water, brown sugar, tomato paste, salt, whole milk, canned black beans, garlic, Garam Masala, chili powder, salted butter, vegetable oil, fresh ginger",Indian
1362,"salt, cilantro leaves, moong dal, water, water, red chili powder, cumin powder, cilantro leaves, diced onion, radish, asafetida, oil, cilantro, bengal gram, green chili, radish, green chili, cumin powder, lemon juice, oil, coriander leaves, radish, ginger paste, cilantro, coriander leaves, asafetida, ginger paste, red chili powder, green gram, diced onion, lemon juice, green chili, bengal gram, green chili, salt",Indian
1363,"coriander leaves, salt, chaat masala, potato, black pepper, chilli powder, oil",Indian
1364,"red curry paste, ground turkey, tomato sauce, salt, cumin, Garam Masala, canned chickpeas, large onion, black pepper, jalapeno, minced garlic",Indian
1365,"sprouts, black pepper, fresh cilantro leaves, extra virgin olive oil, ginger, ground mustard, turmeric, baby eggplants, lemon, tomatoes, sea salt, masala, fennel seed, sea salt, sweet onion, extra virgin olive oil, serrano pepper, roasted cashews, eggplants, roasted garlic",Indian
1366,"ground coriander, water, garlic, turmeric, reduced fat coconut milk, black pepper, yellow onions, salmon filet, sauce, Garam Masala, mustard seeds, serrano peppers, salt, tomatoes, ground cinnamon, ginger, coconut oil",Indian
1367,"onion, tomatoes, bhindi, jeera, chilli powder, coriander powder, salt, garlic, ginger, green chillies, haldi, amchur",Indian
1368,"olive oil, coconut cream, curry powder, tomato paste, ground turmeric, brown rice, fresh cilantro, celtic salt, onion, curry paste, mahi mahi",Indian
1369,"diced tomatoes, jalapeno pepper, ginger, kosher salt, kosher salt, ground cinnamon, garlic, garlic, Garam Masala, cauliflower rice, naan, vegetable oil, chicken stock, lemon juice, boneless chicken, almond flour, ghee, cumin seeds, heavy cream, medium onion, butter, cilantro leaves, ground turmeric, ground cumin, Greek-style yogurt",Indian
1370,"oil, Garam Masala, ginger, lemon juice, all-purpose flour, kasuri methi, onion, coriander powder, ghee, chilli powder, honey, turmeric powder, salt, cream, garlic, paneer, yogurt, garlic",Indian
1371,"ground cardamom, whole-fat plain yogurt, heavy whipping cream, extra fine sugar, fresh mint, frozen mango chunks",Indian
1372,"capsicum, onion, turmeric powder, lemon juice, cumin seeds, green chillies, chilli powder, ginger garlic paste, Garam Masala, paneer, coriander leaves, salt, oil, coriander powder, tomatoes",Indian
1373,"cumin seeds, salt, cumin powder, ghee, Garam Masala, fried onions, basmati rice, peas, paneer, lemon juice",Indian
1374,"capsicum, coriander powder, ginger paste, ginger, red chili, salt, garlic paste, spices, plain yogurt, onion, cumin powder, olive oil, cilantro, tomato paste, green chili, turmeric powder, cream, chicken",Indian
1375,"salt, cumin seeds, ginger, brown sugar, green mango, vinegar, cloves, cinnamon, dried red chilies, coriander seeds, water, cardamom pods, garlic",Indian
1376,"lemon juice, florets, chickpeas, aubergines, fresh ginger, fresh coriander, turmeric, tomato puree, ground cumin, salt, pepper, ground cinnamon, Garam Masala, vegetable oil, garlic cloves, onion, vegetable stock, raisins, chilli, coconut milk",Indian
1377,"salt, black pepper, coriander, basmati rice, garlic, ground cloves, ground ginger, salt, ghee, greek yogurt, cream, coriander, crushed tomatoes, chicken thighs, ground ginger, cumin, fresh lime juice, cilantro, cayenne, cardamom",Indian
1378,"paprika, ground ginger, cayenne pepper, kosher salt, saffron threads, ground cinnamon, sugar, ground cumin, ground coriander, ground black pepper",Indian
1379,"onions, ginger, bay leaf, Garam Masala, serrano pepper, chili powder, skinless chicken thighs, cumin seeds, ghee, tomatoes, turmeric powder, coriander seeds, salt, garlic cloves, black peppercorns, paprika",Indian
1380,"cumin seeds, waxy potatoes, ground coriander, cayenne pepper, vegetable oil, ginger, tomato passata, ground turmeric, eggs, natural yoghurt, steamed rice, coriander, red chillies",Indian
1381,"ground ginger, chicken, fresh lemon juice, paprika, garlic cloves, ground coriander, Garam Masala, cayenne pepper, ground cumin, kosher salt, plain yogurt, olive oil",Indian
1382,"salt, maida flour, Garam Masala, curry leaves, ginger garlic paste, rice flour, oil, lemon, corn flour, mushroom, chilli powder, turmeric powder",Indian
1383,"medium tomatoes, coriander powder, salt, cinnamon stick, red chili powder, cilantro leaves, cream, Garam Masala, ginger, curry powder, ginger, salted butter, paneer, water, yogurt, onion, finely chopped garlic, cumin seeds, salt, garlic cloves, oil, paprika powder, sugar",Indian
1384,"salt, lemon, coriander leaves, oil, moong dal, cumin powder, tomatoes, garlic paste, turmeric powder, onions, cumin seeds, chilli powder",Indian
1385,"fresh cilantro, Garam Masala, cumin, lemon juice, mustard seed, chicken breast, ghee, ground coriander, canned chickpeas, ground turmeric, onions, chicken stock, garlic clove, red chili pepper, ginger root, coconut milk",Indian
1386,"stock cube, vegetable oil, curry leaves, medium onion, red lentils, coconut cream, garlic, turmeric powder, water, black mustard seeds",Indian
1387,"garlic paste, red onions, masala, oil, ginger paste, chicken breasts, salt, yogurt, water, coriander",Indian
1388,"cumin seeds, moong dal, oil, ghee, black peppercorns, cashew nut, curry leaves, salt, ginger, rice",Indian
1389,"black pepper, cumin seeds, ginger, green chilies, turmeric powder, pigeon peas, salt, curry leaves, moong dal, cauliflower florets, coconut oil, asafoetida, cashews",Indian
1390,"ground cardamom, cumin powder, ground coriander, brown mustard, cayenne pepper, ground turmeric, paprika, ground fennel seed, ground cloves, ground cinnamon",Indian
1391,"cumin seeds, chicken, ginger, turmeric powder, onion, salt, fennel seeds, fenugreek seeds, rice, cloves, red chilli, oil, pepper corns, potato, chilli powder, coriander seeds, coconut milk, cinnamon, garlic",Indian
1392,"poppy seeds, cloves, onion, coconut, garlic paste, yogurt, salt, coriander leaves, turmeric powder, sugar, coriander leaves, green chillies, green tomatoes, Garam Masala, cardamoms, ginger, oil, curry leaves, bay leaves",Indian
1393,"turmeric, grated nutmeg, boneless chicken thighs, salt, basmati rice, garlic, onion, green chili, fresh ginger, plain yogurt, water, fresh mint leaves, tomato paste, ghee, fennel seeds, lemon juice, Garam Masala, paprika",Indian
1394,"fresh ginger, Garam Masala, sauce, chopped onion, salt, Garam Masala, tomato sauce, red chili powder, red chili powder, chicken, vegetable oil, vegetable oil, salt, fresh ginger, cumin, heavy cream, chicken, chopped garlic, chopped garlic, yogurt, chopped cilantro",Indian
1395,"ground coriander seed, ginger garlic paste, salt, chicken wings, fenugreek, red chili powder, turmeric, tomato paste, fresh cilantro, seasoning, heavy whipping cream, tandoori seasoning, butter, garlic powder, greek yogurt, ghee, cream cheese, fresh cilantro, ground cumin, salt, chaat masala",Indian
1396,"channa dal, sesame oil, curry leaves, turmeric powder, lemon, cooked rice, peanuts, mustard seeds, tamarind, fenugreek seeds, salt",Indian
1397,"salt, bay leaves, garam masala powder, onions, chopped tomatoes, ghee, cinnamon, basmati rice, cilantro, mint, oil, green chillies, turmeric powder, ginger garlic paste, chicken, cardamom, cloves, yogurt, juice, coconut milk",Indian
1398,"salt, water, carrot, Garam Masala, red chili powder, turmeric powder, butter, cumin seeds, garlic, onion, chopped bell pepper, tomato paste, oil, basmati rice, tomato, tilapia",Indian
1399,"salt, vegetable stock, ground coriander, ground cumin, vegetable oil, ground ginger, garlic, chickpea flour, date",Indian
1400,"bay leaf, coriander leaves, black peppercorns, turmeric powder, peanuts, toor dal, cloves, cinnamon stick, mustard seeds, red chilli, water, ghee, chilli powder, salt, moong dal, onion, cumin seeds, rice, star anise",Indian
1401,"cooking oil, cardamom powder, paneer, chilli powder, cashewnuts, medium onion, black cardamom, white pepper, medium potatoes, kasuri methi, cream, cornflour, salt, cloves, tomato puree, salt, medium onion, cinnamon, bay leaf, ginger garlic paste, green cardamom, cooking oil, green chillies",Indian
1402,"cayenne, ground ginger, naan, plain greek yogurt, cardamom, onion, salt, basmati rice, cumin, butter, coriander, nutmeg, tomato puree, paprika, garlic, olive oil, lime juice, chicken, fresh cilantro, water, chicken, half-and-half",Indian
1403,"large onion, oil, sugar, turmeric powder, coconut milk, minced garlic, curry powder, penne pasta, oil, coconut milk, sugar, cardamoms, tomato paste, veggies, turmeric powder, tomato paste, whole peeled tomatoes, salt, minced garlic, curry leaves, chilli powder, Italian seasoning, Italian seasoning, veggies, curry powder, salt, pandan leaf, large onion, cardamoms, chilli powder, penne pasta, pandan leaf, curry leaves, whole peeled tomatoes",Indian
1404,"onions, large potato, cumin seeds, basmati rice, Garam Masala, red chilly powder, green peas, green chilies, bay leaves, cinnamon, oil, salt",Indian
1405,"chickpeas, cooked rice, tomato paste, garlic, Garam Masala, crushed tomatoes, russet potato, salt, plain yogurt, olive oil, fresh cilantro, yellow onion, ginger",Indian
1406,"atta, salt, herbs, Garam Masala, garbanzo bean flour, turmeric, chilli powder",Indian
1407,"basmati rice, garlic paste, cloves, bay leaf, onions, tomatoes, cinnamon sticks, lemon juice, shahi jeera, coriander leaves, mint leaves, cardamom, yogurt, mutton, coriander powder, red chili powder, green chili, salt, oil",Indian
1408,"green chilli, yogurt, coriander leaves, ginger, salt, cucumber, chat masala",Indian
1409,"olive oil, garlic cloves, ground cardamom, spinach leaves, kosher salt, fresh ginger, cayenne, onion, ground coriander, plain low fat greek yogurt, garam masala, turmeric",Indian
1410,"plain yogurt, cumin, fresh ginger, salt, cucumber, fresh cilantro, coriander",Indian
1411,"vanilla extract, sweetened condensed milk, saffron, whipping cream, shelled pistachios, cardamom powder",Indian
1412,"minced garlic, carrots, chicken thighs, walnuts, carrot, cumin powder, Garam Masala, cinnamon powder, cardamom powder, raisins, basmati rice, oil, salt, onion, hot water",Indian
1413,"chutney, salt, salt, besan (flour), onion, coconut, cumin seeds, baking soda, chilli powder, ginger garlic paste, boiled potatoes, buns, red chillies, turmeric powder, oil, coriander leaves, rice flour, garlic, oil, urad dal, chutney, green chillies, tamarind, mustard seeds",Indian
1414,"neutral oil, hot chilies, masoor dal, cinnamon bark, chili powder, brown mustard seeds, cumin seeds, kosher salt, medium tomatoes, garlic ginger paste, panch phoran, chicken thighs, turmeric powder, water, jalapeño",Indian
1415,"curry powder, canola oil, salt, ginger, garlic, pepper, plain greek yogurt, lemon",Indian
1416,"ginger paste, asafoetida, panch phoran, bay leaf, salt, small onion, red chillies, fennel seeds, canned chickpeas, Garam Masala, sugar, vegetable oil, ground cumin, ground turmeric, butternut squash, ground coriander, boiling water",Indian
1417,"chickpeas, fresh ginger, garlic, tomato puree, Garam Masala, coriander powder, cloves, coriander leaves, olive oil, chopped frozen spinach, onion, medium tomatoes, salt, peppercorns, turmeric, brown rice, water",Indian
1418,"tomato paste, green chili pepper, cinnamon stick, water, ghee, coriander powder, cloves, bay leaf, mango, cayenne powder, onion, cilantro, coriander powder, turmeric powder, ginger, cumin seeds, black peppercorns, cinnamon stick, cayenne powder, black cardamom, cinnamon, chickpeas, kasoori methi, cayenne powder, masala, salt, turmeric powder, water, coriander powder, black cardamom, garlic, cloves",Indian
1419,"sugar, potatoes, butter, brown lentil, turmeric, cumin seeds, curry powder, onion, red pepper flakes, minced ginger, red lentils, coconut milk, tomato, curry powder, cilantro, rice, minced garlic",Indian
1420,"garam masala, black peppercorns, chicken, coriander powder, green chilli, garlic paste, lemon juice, black peppercorns, coriander leaves, onion, oil, salt",Indian
1421,"sauce, Garam Masala, ghee, coriander, chicken breast, crushed tomatoes, cauliflower rice, ginger, chili powder, heavy cream, Garam Masala, cumin, onion, ginger, cilantro, coconut oil, garlic, garlic, plain yogurt",Indian
1422,"Garam Masala, turmeric, butter, garlic, cumin seeds, onion, ginger, red lentils, ground coriander",Indian
1423,"salt, black pepper, lemon juice, garlic, oil, turmeric, yogurt, garlic, onion, cumin, boneless chicken, coriander leaves, chili powder, tandoori masala",Indian
1424,"ground cumin, olive oil, kosher salt, paprika, kosher salt, chopped cilantro, ginger, yogurt, ground turmeric, chili powder, lemon wedges, yogurt, yukon gold potatoes, green chili, Garam Masala, garlic, florets, salt, cumin seeds, granulated sugar, chicken thighs, red onion",Indian
1425,"fenugreek leaves, cinnamon, oil, curd, turmeric powder, red chili powder, coriander powder, salt, cumin powder, onions, tomato, green peas, paneer, garlic paste, cumin seeds, sugar, garam masala, cloves, coriander leaves",Indian
1426,"salt, chicken thighs, cumin, bouillon cubes, fresh curry leaves, fresh tomatoes, garlic, fresh mint leaves, curry powder, ground turmeric, potatoes, minced ginger, coriander, large onion, vegetable oil, pepper",Indian
1427,"Garam Masala, sauce, coconut milk, cilantro, salt, cayenne, yogurt low-fat, garlic, brown rice, cornstarch, raita, tomato paste, ginger root, onion, boneless, skinless chicken breasts",Indian
1428,"olive oil, flaxseeds, water, salt, carrots, cilantro, lemon juice, serrano pepper, cherry tomatoes, ginger, cashews, spring onions, raisins, cilantro, baby spinach, cilantro, fresh mint, mint, serrano pepper, peas, cumin, mint leaves, cherry tomatoes, radicchio, onion, coriander, serrano peppers, turmeric, gluten free flour, water, scallions, masala, cucumbers, neutral oil, basmati",Indian
1429,"garlic, cumin seeds, cinnamon, kasoori methi, red onion, ginger, sugar, tomato paste, medium tomatoes, cloves, green cardamom pods, coconut, coriander seeds, bay leaves, cashews",Indian
1430,"oil, jeera, green chilli, mint leaves, cauliflower, coriander leaves, salt, ginger, oil, salt, chilli powder, turmeric powder, amchur, whole wheat flour, coriander powder, water",Indian
1431,"mustard oil, asafoetida powder, black mustard seeds, baby potatoes, dried chillies, yellow onion, ginger, turmeric powder, kale, curry leaves",Indian
1432,"green pepper, cumin, canola oil, garlic cloves, large tomato, chopped cilantro, red pepper, eggplant, chipotle, mushrooms, curry, coriander seeds, brown mustard seeds",Indian
1433,"diced tomatoes, lemon juice, yellow onion, chickpeas, fresh cilantro, fresh ginger, grape seed oil, ground coriander, coconut sugar, ground cumin, ground turmeric, sea salt, chili powder, green chilies, Garam Masala, garlic",Indian
1434,"mung beans, fresh ginger root, black mustard seeds, ground cumin, water, liquid aminos, chopped fresh cilantro, asafoetida, fenugreek seeds, basmati rice, ground turmeric, coconut oil, bay leaves",Indian
1435,"urad dal, fresh ginger, water, onion, garlic, cloves, Garam Masala, crushed tomatoes, cumin seeds, cayenne pepper, ground turmeric, kosher salt, chopped fresh cilantro, red kidney beans, cardamom pods",Indian
1436,"ghee, fine sea salt, ground turmeric, ground coriander, button mushrooms, basmati rice, chilli powder, ginger, tomatoes, garlic, muscovado, cumin seeds, coriander, fennel seeds",Indian
1437,"ground cumin, fresh lime juice, fennel, sea salt, greek yogurt, chopped fresh mint, cayenne",Indian
1438,"water, salt, cumin seeds, mango, fresh mint leaves, green chili, coriander leaves",Indian
1439,"onion, chopped potatoes, tomato, garam masala, asafetida, garlic paste, turmeric powder, water, oil, mustard seeds, salt, carrots, frozen peas, green chilli, cumin seeds, coriander leaves",Indian
1440,"ground cinnamon, crushed tomatoes, ground paprika, salt, onion, butter, lemon juice, ground ginger, bone in chicken thighs, plain yogurt, curry powder, ground cumin, ground pepper, brown sugar",Indian
1441,"salt, tomatoes, chilli powder, turmeric powder, coriander leaves, onion, green chillies, coriander powder, Garam Masala, lamb, boiling water, ginger garlic paste, large potatoes, ghee, cumin powder, greek yogurt",Indian
1442,"turmeric powder, cumin seeds, water, pineapple, coconut, red chillies, yogurt, ginger, coconut oil, mustard seeds, green chilli, salt, garlic, jaggery, mustard seeds, curry leaves",Indian
1443,"mustard seeds, coconut, green chilies, curry leaves, curry leaves, lemon juice, asafetida, ginger, oil, chana dal, green peas, green peas, ginger, onion, chana dal, carrot, oil, asafetida, salt, coconut, green chilies, carrot, mustard seeds, onion, salt, lemon juice",Indian
1444,"water, fresh cilantro, plain greek yogurt, basmati rice, ground cinnamon, ground cumin, ground coriander, onions, kosher salt, sugar, brown lentils, lemon juice, ground allspice, cayenne pepper, black pepper, water, vegetable oil, onions, garlic cloves, kosher salt, oil, minced garlic, kosher salt, kosher salt",Indian
1445,"chickpeas, reduced sodium chicken broth, Garam Masala, kale, garlic, salt, ground coriander, extra-virgin olive oil, ground cumin",Indian
1446,"ground ginger, ground cayenne, ground black pepper, red lentils, vegetable stock, garlic, mustard powder, ground cinnamon, ground turmeric, curry powder, onion",Indian
1447,"cumin seeds, cardamom pods, coriander seeds, ginger, green mango, water, dry red chilies, garlic, cinnamon, demerara sugar, vinegar, salt, cloves",Indian
1448,"atta, fenugreek leaves, sesame seeds, coriander leaves, oil, chilli powder, yogurt, green chillies, salt",Indian
1449,"salt, water, coriander powder, whole wheat flour, chilli powder, paneer, ghee, amchur, salt, cumin powder, ginger, green chillies",Indian
1450,"brown mustard seeds, cumin seeds, lemon, red onions, vegetable oil, salt, mint, chili powder, yogurt low-fat, carrots",Indian
1451,"large tomato, shallots, fennel seeds, cumin seeds, Garam Masala, pepper, cumin powder, ginger, red chili powder, black peppercorns, turmeric powder, oil, curry leaves, chicken breast, water, garlic cloves, cinnamon sticks, salt, bay leaf",Indian
1452,"chilli powder, Garam Masala, sunflower oil, salad, curry powder, salt, chicken drumsticks",Indian
1453,"fresh coriander, spinach, curry powder, baobab powder, red lentils, flatbread, ginger, red chilli, water, chopped tomatoes, non dairy yogurt, coconut oil, salt, onion, garlic, new potatoes",Indian
1454,"minced garlic, grapeseed oil, ground coriander, mango, fennel seeds, pepper, cayenne pepper, Garam Masala, Garam Masala, lamb rack, minced ginger, small onion, turmeric, coriander seeds, smoked paprika, salt, salt, pepper, grapeseed oil, ground cumin, fenugreek leaves",Indian
1455,"coconut milk, masala, ground cardamom, ground cinnamon, whole black peppercorns, whole cloves, crushed garlic, onions, chicken broth, cumin seeds, fresh ginger, basmati rice, olive oil, salt",Indian
1456,"salt, green chillies, chilli powder, cumin seeds, garlic cloves, lemon juice, asafetida, dry coconut, turmeric powder, ginger garlic paste, ginger, salt, cloves, potato, lemon juice, green chillies, coriander leaves, coriander leaves",Indian
1457,"Garam Masala, medium onion, jalapeno, light coconut milk, tomato paste, ginger, cooking oil, salt, chopped cilantro, water, medium tomato, garlic cloves, shrimps",Indian
1458,"chilli flakes, turmeric powder, vegetable stock, coriander, red lentils, mustard seeds, ghee, salt, onion, cumin seeds, garlic cloves",Indian
1459,"water, turmeric, garlic cloves, cardamom pods, basmati rice, mustard seeds, chili flakes, salt, cumin seeds, vegetable oil, cloves, onion, cinnamon",Indian
1460,"chopped tomato, red chili powder, garam masala powder, oil, coriander powder, turmeric powder, kasuri methi, coriander leaves, bay leaf, chopped green chilies, salt, potato, cauliflower, onion, red chili, cumin powder, ginger garlic paste, cumin seeds, ghee, ginger",Indian
1461,"yellow onion, amchur, garam masala, diced tomatoes in juice, garlic, salt, serrano chilies, canola oil, fenugreek leaves, fresh ginger root, cayenne pepper, water, coriander seeds, cumin seed, chickpeas, turmeric, paprika, lemon juice",Indian
1462,"chili powder, lemon juice, cilantro, garlic, cumin, chickpeas, diced tomatoes, basmati rice, turmeric, baby spinach, butter, coconut oil, garlic naan, crushed tomatoes, salt, Garam Masala, water, yellow onions",Indian
1463,"vegetable oil, all purpose flour, apple juice, garbanzo beans, chopped onion, curry paste, frozen puff pastry",Indian
1464,"peanut oil, ground coriander, cauliflower, black mustard seeds, ground turmeric, paprika, plum tomatoes, serrano chiles, kosher salt",Indian
1465,"water, ground turmeric, chicken thighs, peeled fresh ginger, fresh cilantro, chopped garlic, serrano, cumin seeds, garam masala, oil, tomato paste, onion, salt",Indian
1466,"grated coconut, coconut oil, ghee, mustard seeds, thai chiles, kosher salt, thai chile, basmati rice, cashews, curry leaves, water",Indian
1467,"ground cumin, black pepper, ground coriander, Garam Masala, cinnamon stick, serrano peppers, amchur, chili powder, coconut sugar, medium yellow onion, chickpeas, freshly grated ginger, sea salt, ground turmeric, tomatoes, garlic, coconut oil, ground cloves, bay leaves, finely chopped cilantro",Indian
1468,"grated coconut, moong dal, mustard seeds, cooked rice, ginger, salt, coconut oil, curry leaves",Indian
1469,"garlic, fennel powder, garam masala powder, tomato, coriander leaves, soya chunks, whole cashew, salt, ginger, pepper, onion, fennel seeds, cream, chilli powder, chilli powder, turmeric powder, coriander powder",Indian
1470,"chili powder, chaat masala, onion, lemon juice, garlic clove, chickpeas, cucumber, cilantro, vinaigrette, vegetable oil, onion",Indian
1471,"ginger garlic paste, chilli powder, cumin powder, fish, turmeric, lemon, salt, oil",Indian
1472,"coconut milk, ground turmeric, long grain white rice, canola oil, skinless boneless chicken breasts, onion, ground coriander, salt, cayenne pepper, curry powder, chopped fresh cilantro, baby spinach, garlic, cumin",Indian
1473,"ghee, Garam Masala, green cardamom, onion, cloves, cilantro, coriander powder, oil, cayenne, black cardamom, star anise, boneless chicken thighs, cumin seeds, masala, salt",Indian
1474,"olive oil, fresh cilantro, seasoning, seasoning, coconut milk, garlic, ground chicken, red onion",Indian
1475,"chopped tomatoes, garlic, frozen peas, chili flakes, ginger, olive oil, spice blend, onion, salt, small potatoes, sugar",Indian
1476,"light coconut milk, pork strips, black mustard seeds, salt, vegetable oil, tikka masala curry paste, basmati rice, onion, zucchini, coriander leaves",Indian
1477,"cilantro, heavy cream, cumin, garlic, olive oil, paprika, boneless skinless chicken breasts, cornstarch, cayenne pepper, bay leaves, black pepper, cinnamon, salt, plain greek yogurt, Garam Masala, small onion, fresh ginger, tomato puree",Indian
1478,"ground coriander, salt, garlic, onions, vinegar, pineapple chunks, sugar, fresh ginger, mangoes, ground cloves, ground cardamom, ground cinnamon, water, red bell pepper, pepper",Indian
1479,"minced garlic, ghee, boneless skinless chicken breasts, unsalted almonds, tomatoes, lime, turmeric, Garam Masala, cilantro leaves, salt, basmati rice, cumin, low sodium chicken broth, ginger paste, yellow onion, golden raisins, jalapeno pepper",Indian
