ID,Ingredients,Cuisine
944,"cauliflower florets, steamed rice, toasted cashews, fire roasted tomatoes, minced ginger, diced onion, Garam Masala, garlic, coconut milk, avocado oil, chopped fresh cilantro, sea salt, ground cardamom, ground turmeric",Indian
945,"coconut milk, smoked paprika, cumin, spinach, garlic, coconut oil, coriander, tomato paste, marsala, stewed tomatoes, cilantro leaves, masala, red pepper flakes, avocado oil, lentils, red onion, salt",Indian
946,"frozen peas, fresh cilantro, chili flakes, turmeric, tomato paste, curry powder, ground cumin, steamed rice, yellow onion, idaho potatoes, kosher salt, garlic cloves, coconut milk, coconut oil, cayenne pepper",Indian
947,"warm water, turmeric, vegetable oil, large carrots, salt, coriander leaves, salt, free range egg, lemon juice, freshly ground black pepper, large potatoes, green chilli, plain flour, vegetable oil, curry leaves, garlic cloves, small onion, black mustard seeds, Garam Masala, frozen peas",Indian
948,"chicken, yogurt, onions, garlic paste, green cardamom, ghee, coriander powder, red chili powder, ginger paste, cloves, salt",Indian
949,"chile de arbol, coriander seeds, mulato chile, red chile, mustard seeds, chili powder, cumin seeds, pure olive oil, salt, tomatoes, sugar, seeds, white distilled vinegar",Indian
950,"curry, garlic, turmeric powder, garam masala powder, ginger garlic paste, ginger, black cardamom, bay leaves, mustard oil, potatoes, mustard oil, cloves, lemon juice, sugar, hung curd, cumin powder, chilli powder, salt, cinnamon, tomato, coriander powder, onion, red chillies, green cardamom, fresh coriander",Indian
951,"green onion, cucumber, coriander, cilantro, cumin, yogurt, salt, pepper",Indian
952,"basmati rice, mace, bay leaf, cardamoms, salt, bay leaf, cloves, star anise, onions, raisins, cinnamon, mace, water, onions, raisins, basmati rice, water, cashew nuts, salt, water, cashew nuts, water, ghee, ghee",Indian
953,"Garam Masala, red skinned potatoes, salt, fresh ginger, baby spinach, boneless, skinless chicken thighs, ground black pepper, red wine vinegar, garlic, chopped fresh cilantro, tomato paste, no-salt-added diced tomatoes, Madras curry powder",Indian
954,"powdered ginger, diced tomatoes, minced onion, water, pepper flakes, sea salt, turmeric, Garam Masala, red lentils",Indian
955,"water, onion, garlic cloves, chili, cumin powder, coconut, turmeric powder, ginger garlic paste, coriander seed, black pepper, tamarind paste",Indian
956,"ground cumin, kosher salt, ground coriander, ground turmeric, ground cayenne pepper, cauliflower, cooking oil, freshly ground black pepper",Indian
957,"Garam Masala, salt, onion, coriander powder, ginger, yogurt, green cardamom, chilli powder, whole chicken, cinnamon, cloves, vegetable oil, cloves, cashew nuts, turmeric powder",Indian
958,"butter, ground cinnamon, ground coriander, fresh root ginger, tomato purée, sugar, ground turmeric, vegetable oil, fenugreek, salt, ground cardamom, chilli powder, chopped tomatoes, ground cumin, bone in chicken thighs, Greek-style yogurt, tandoori masala, garlic cloves, white onions",Indian
959,"coriander powder, cumin powder, chickpea, coriander leaves, cumin, vegetable oil, cubed potato, chaat masala, green chili, turmeric powder, onion, ginger garlic paste, salt, mustard oil, bay leaf, cardamom, cinnamon, black cardamom, red chili powder",Indian
960,"onion, green chilis, lime, vegetable oil, salt, curry leaves, coriander leaves, potatoes, mustard seeds, turmeric powder",Indian
961,"minced garlic, salt, cayenne, ground coriander, turmeric, minced ginger, greek yogurt, ground cumin, ghee, chicken thighs, cilantro, Garam Masala, smoked paprika, lemon juiced",Indian
962,"coriander leaves, chilli powder, salt, cumin powder, fenugreek, medium tomatoes, chicken, coconut cream, garlic paste, onion, caraway seeds, green chilli, oil, turmeric powder, water, coriander powder, Garam Masala",Indian
963,"cloves, coriander leaves, boiling water, yogurt, cinnamon, green chillies, vegetable oil, salt, green cardamom, cloves, turmeric powder, water, onion, tomato, sugar, garam masala, ginger, chilli powder",Indian
964,"Garam Masala, turmeric, cumin seeds, fresh ginger, chilli, water, garlic, salt, fresh coriander, tomatoes, ginger",Indian
965,"coconut milk, salt, minced onion, garlic, curry powder, fresh ginger, large shrimp, freshly ground black pepper, crushed red pepper flakes, peanut oil, fish, fresh cilantro",Indian
966,"onion, ghee, saffron threads, vegetable oil, salt, black peppercorns, green cardamom pods, salt, green cardamom pods, fresh mint leaves, milk, coriander leaves, cinnamon, green chillies, garlic paste, cloves, cinnamon, almonds, bay leaf, turmeric powder, ghee, black cumin seeds, basmati rice, coriander leaves, onions, cloves, vegetable oil, ginger paste, lime juice, yogurt, boneless chicken",Indian
967,"salt, oats, corn kernels, green chili, green peas, oil, flour, chat masala, capsicum, cumin powder, garlic powder, coriander leaves, onion, mango powder, carrots",Indian
968,"cumin seeds, oil, salt, lemon juice, chilies, asafetida, sugar, ginger, chopped cilantro",Indian
969,"salt, green peas, cumin, cumin seeds, fresh cilantro, oil, coriander, freshly ground black pepper, red onion, white button mushrooms, cayenne pepper",Indian
970,"garam masala, unsalted butter, salted mixed nuts, cayenne pepper, peeled fresh ginger, ground cumin",Indian
971,"low fat milk, raw honey, pistachio nuts, plain greek yogurt, mint, frozen mango, ginger, vanilla, ground cardamom, ground turmeric",Indian
972,"kosher salt, cilantro sprigs, mustard greens, chicken legs, water, cumin seeds, fresh turmeric, lime wedges, garlic cloves, palm sugar, kaffir lime leaves, cardamom pods, ginger, lemongrass, shallots, curry powder, egg noodles, oil, shrimp paste, coriander root, chile peppers, curry paste, coconut milk, coriander seeds, egg noodles, canola oil, shallots",Indian
973,"lemons, chilli powder, ground cumin, tiger prawns, freshly ground black pepper, ground cinnamon, butter, coriander leaves, ground cumin, salt, red chilli, fresh ginger, garlic cloves, yoghurt, double cream, garlic cloves, Garam Masala, fresh ginger, tomatoes, red onion",Indian
974,"oil, tomato, chilli powder, eggs, coriander powder, salt, black pepper, fennel seeds, dal, turmeric powder, cinnamon stick, mustard seeds, cumin seeds, onion, star anise, red chilli, water, Garam Masala, cloves",Indian
975,"green cardamom, chicken, potatoes, mustard oil, tomato, yogurt, chilli powder, turmeric powder, onions, cloves, coriander powder, sugar, cinnamon stick, salt, garlic paste, garam masala, mustard oil, bay leaves, cumin powder",Indian
976,"cumin, chicken thighs, red chilies, garlic, turmeric powder, cloves, ginger, diced onions, peppercorns, white wine vinegar, salt, olive oil, spice mix, mustard seeds, diced potatoes, cardamoms, cinammon",Indian
977,"lemon juice, plain whole milk yogurt, chopped cilantro, minced ginger, kosher salt, garlic cloves, cayenne pepper, curry powder",Indian
978,"curry powder, salt, baking powder, paprika, water, chicken, pepper, garlic, vegetable oil, oil, all purpose flour, chili powder, butter, water, curry, roti, onion",Indian
979,"garlic cloves, curry powder, plum tomato, salt, mustard seeds, vegetable oil",Indian
980,"cardamom seeds, chicken, shallots, kaffir lime leaves, coriander seeds, coconut milk, peanut oil, kosher salt, cinnamon, rice, grated nutmeg, whole cloves, garlic, lemongrass, candlenuts, ginger, cumin seeds, fennel seeds, ground turmeric, thai chiles",Indian
981,"cinnamon stick, cloves, warm water, small onion, ghee, cumin seeds, garlic, fresh mint leaves, green chili, black peppercorns, fresh cilantro, warm water, grated coconut, basmati rice",Indian
982,"cloves, coconut milk, red onion, black peppercorns, black mustard seeds, carrots, ginger, curry leaves, lemon, basmati rice, leaves, cumin seeds, vegetable oil, red chilli",Indian
983,"garlic, tomato, red chillies, onion, coriander, cumin seeds, salt, tamarind extract, lemon, coriander seeds, white fish fillets, turmeric, onion, chillies, oil, coconut, turmeric powder",Indian
984,"asafetida, roasted cashews, dry coconut, red chilli, salt, red chilli, ghee, plain yogurt, curry leaves, curry leaves, mustard seed, water",Indian
985,"chopped fresh cilantro, garlic, ground turmeric, tomato paste, fresh ginger, diced tomatoes, cooked rice, plain yogurt, heavy cream, yellow onion, boneless, skinless chicken thighs, ground cumin, Garam Masala, ground coriander, kosher salt",Indian
986,"tomatoes, ghee, cumin seeds, crushed black pepper, coriander leaves, sugar, salt",Indian
987,"lemon juice, diced tomatoes, garlic, ground lamb, salt, ground coriander, jalapeno pepper, ground cumin, frozen peas, Garam Masala, onion, ginger, coconut oil, bay leaf, ground cardamom",Indian
988,"salt, ginger, coconut sugar, paprika, green chili peppers, Garam Masala, ground coriander, garlic, red bell pepper, coconut milk, chopped fresh cilantro, extra firm tofu, cayenne pepper, black pepper, white wine vinegar, ground turmeric, lemon juice, salt, nutritional yeast, coconut oil, cumin seeds, yellow onion, cherry tomatoes, tomato paste",Indian
989,"Garam Masala, cashew nut, tomato, red chili powder, coriander powder, onions, cream, bay leaves, chicken, garlic paste, oil, cardamom, turmeric powder, salt, fenugreek leaves, cumin seeds, butter",Indian
990,"cilantro leaves, water, seeds, coriander powder, yellow mustard seeds, salt, cumin seeds, beans, ginger, asafoetida, vegetable broth, coriander powder, turmeric powder, long grain rice, ghee, seeds, water",Indian
991,"water, chopped fresh cilantro, cumin seeds, canola oil, yellow lentils, ground coriander, garlic, onion, cayenne pepper, mangoes, fresh ginger, salt, ground turmeric",Indian
992,"salt, spinach, chickpeas, onion, cherry tomatoes, basmati rice, garlic cloves, ginger, pepper, curry powder, cilantro, olive oil, cauliflower",Indian
993,"frozen peas, ground black pepper, fresh cilantro, brown rice, kosher salt, tomato paste, minced garlic, ground cumin, yellow onion, minced garlic, fresh ginger, Garam Masala, kosher salt, plain greek yogurt, naan, ground coriander, cauliflower, coconut oil, turmeric, crushed tomatoes, paneer, fresh ginger, cayenne pepper, Garam Masala, red bell pepper, plain greek yogurt",Indian
994,"garam masala, lamb stew meat, ground cumin, cinnamon sticks, cardamom pod, green cardamom pods, yellow onions, ground coriander seed, yogurt, lemon juice, garlic cloves, fresh ginger, turmeric, bay leaf, plum tomatoes, salt, chopped cilantro, vegetable oil, cloves, chili powder",Indian
995,"garam masala, salt, plum tomato, plain low-fat yogurt, pitas, finely chopped onion",Indian
996,"amchoor, fresh cilantro, fresh mint, Thai peppers, salt, lemon juice, cumin seeds",Indian
997,"onions, fresh ginger, turmeric, cayenne pepper, salt, lemon, salt, garlic, cumin, ground cloves, cilantro stems, coconut milk, chili powder, Garam Masala, almonds, tomato puree",Indian
998,"garlic cloves, cardamom powder, water, black cardamom, ghee, turmeric powder, keema, cinnamon powder, green chilies, red chili powder, potato, coriander powder, coriander leaves, cumin powder, meat, ginger, large tomato, onion",Indian
999,"salt, cayenne, vegetables, cashews, onion, heavy cream, garlic, paprika, ghee, Garam Masala, water, water, fenugreek leaves, tomato, cumin seeds, ground cardamom, serrano pepper, cilantro, ginger, potato, cashews, coriander powder, golden raisins, turmeric powder",Indian
1000,"fresh mint leaves, ground cumin, garam masala, diced onions, ground turmeric, minced ginger, chili powder, sea salt, fresh ginger, cumin seed, lemon juice, bone in chicken thighs, garlic, tandoori paste, natural low-fat yogurt, coriander, chopped green chilies, chopped garlic, sea salt, ground coriander",Indian
1001,"asafoetida, oil, green chilli, coriander leaves, poha, potato, turmeric powder, sugar, lemon juice, peanuts, coconut, salt, green peas, onion, curry leaves, mustard seeds",Indian
1002,"water, onion, butter, coconut milk, salt, curry powder, ground turmeric, fresh ginger, chopped fresh cilantro, toasted cashews, jasmine rice, garlic",Indian
1003,"tomatoes, kasuri methi, oil, cream, butter, bay leaf, red chili powder, onions, salt, paneer, garam masala, cashew nuts, ginger, garlic cloves, coriander powder, full-fat milk, green chillies",Indian
1004,"fresh ginger, curry leaves, sunflower oil, yoghurt, lime wedges, sirloin steak, basmati rice",Indian
1005,"garlic, tomato paste, spice mix, methi, base, brown sugar, Madras curry powder, sauce, pre cooked chicken, paprika, kosher salt, chili powder, oil",Indian
1006,"ground coriander, cloves, table salt, cardamom pods, large garlic cloves, cinnamon sticks, bay leaves, peppercorns, onions, fresh ginger, Garam Masala, canola oil, smoked paprika, freshly ground black pepper, ground cumin, beef roast, whole plain yogurt, cayenne pepper",Indian
1007,"plain yogurt, salt, lime juice, ginger root, red onion, fresh ginger root, red chili, garam masala, garam masala, heavy cream, clarified butter, garlic, tomatoes, boneless skinless chicken breasts, salt",Indian
1008,"oil, garlic cloves, root ginger, chopped tomatoes, salt, green chillies, Garam Masala, soft brown sugar, spinach leaves, cauliflower, pepper, chilli powder, onion, coconut milk, tumeric, boneless chicken thighs",Indian
1009,"cream, bay leaf, salt, cinnamon, garlic, sugar, ginger, green cardamoms, butter, tomatoes, cloves, coriander powder, onion, cashews, fenugreek leaves, Garam Masala, cumin seeds, chilli powder, butter, paneer, turmeric powder",Indian
1010,"ground coriander, kosher salt, ground cumin, ground ginger, paprika, garlic cloves, chicken, Garam Masala, olive oil, fresh lemon juice, plain yogurt, cayenne pepper",Indian
1011,"asafoetida, vegetable stock, mustard seeds, extra virgin olive oil, salt, cinnamon, garlic, ground coriander, onion, lime, tomatoes, chile powder, salt, chopped cilantro, red lentils, cumin seeds, green chilies, turmeric, cloves, fresh ginger",Indian
1012,"minced ginger, bay leaf, cloves, baby potatoes, red chili powder, turmeric powder, small tomatoes, pink salt, green cardamom, onion, garlic cloves, cilantro, Garam Masala, soy yogurt, cashew",Indian
1013,"water, salt, seeds, cumin, cayenne, turmeric, onion, yellow split peas, pepper, cloves, margarine",Indian
1014,"pepper, turmeric powder, garlic paste, jeera, fish, red chilly powder, oil, salt, water",Indian
1015,"ginger paste, chaat masala, ground white pepper, sour cream, lemon, chicken thighs, salt, garlic paste, cooking oil, fresh coriander, salt, green chilies, cardamom, shredded mild cheddar cheese",Indian
1016,"bay leaves, ginger, garam masala, garlic, ground almonds, onions, chicken, corn oil, butter, single cream, tomatoes, green cardamom pods, salt, ground cinnamon, natural yogurt, chili powder, fresh coriander, ground cloves",Indian
1017,"ground cumin, cayenne pepper, kosher salt, mint leaves, hothouse cucumber, plain yogurt",Indian
1018,"garam masala powder, boiled potato, salt, turmeric powder, green chili, all purpose flour, oil, warm water, black pepper, ginger powder, cumin seeds, coriander leaves, fennel seeds, coriander powder, salt",Indian
1019,"coriander leaves, ginger, onion, tomato puree, butter, salt, red chile powder, vegetable oil, garlic cloves, almonds, garam masala powder",Indian
1020,"unsalted butter, frozen peas, curry powder, basmati rice, yellow onion, salt, cauliflower, green beans, red pepper, garlic, water",Indian
1021,"urad dal, oil, grated carrot, water, green chillies, red chilli, ghee, yogurt, salt, coriander leaves, cashew nuts, cumin seeds, salt, mustard seeds, asafoetida, dal, ginger, curry leaves, rava",Indian
1022,"ground turmeric, fresh mint, canola oil, red chili flakes, curry powder, green chilies, garlic, breadcrumbs, egg, salt, grated carrot, curry leaves, black pepper, minced onion, potatoes, cumin seeds, fresh ginger, bell pepper, zucchini, lime juice",Indian
1023,"turmeric powder, salt, oil, curry leaves, tomato, onion, chilli powder, urad dal, mustard, okra, jeera, oil",Indian
1024,"chilli powder, salt, tomatoes, turmeric, onion, green chillies, cumin seeds, Garam Masala, fenugreek, garlic, chicken thighs, vegetable oil, fresh ginger, coriander seeds, yoghurt, water",Indian
1025,"ghee, water, curd, corn flour, saffron strands, oil, sugar, maida, rose essence, cardamom powder, food colour, baking soda",Indian
1026,"red wine vinegar, chilli powder, vegetable oil, ground coriander, quinoa, ground turmeric, ground cumin, rocket, ground cumin, garlic, cardamom pods, Garam Masala, red onion, cauliflower, onion, Tahini, ground turmeric, ground coriander, smoked paprika, chopped coriander, salt, cloves, lemon juice, caster sugar, hot chilli powder, vegetable oil",Indian
1027,"gram flour, ginger, ground cumin, nigella seeds, yellow onion, Garam Masala, ground cumin, vegetable oil, butternut squash, fresh coriander, chilli powder, turmeric, salt, mango chutney",Indian
1028,"spinach, pepper, whole wheat flour, chaat masala, oil, Garam Masala, salt",Indian
1029,"oil, jeera powder, cumin seeds, potato, Garam Masala, Garam Masala, spinach, ginger paste, red chili powder, potato, onion, fenugreek leaves, tomatoes, spinach, cumin seeds, onion, fenugreek leaves, salt, red chili powder, salt, tomatoes, jeera powder, sugar, sugar, oil, turmeric powder, ginger paste, turmeric powder",Indian
1030,"mustard seeds, cucumber, flour, mint leaves, cumin seeds, cherry tomatoes, yoghurt",Indian
1031,"garlic cloves, vegetable oil, jalapeno chile, yogurt, turmeric powder, chili powder, unsweetened soymilk, onion, extra firm tofu, ginger, lemon juice, salt, cilantro, chopped cilantro",Indian
1032,"garlic, onion, ground turmeric, full fat coconut milk, cumin seeds, neutral oil, cayenne pepper, salt, fresh ginger, Garam Masala, ground black pepper, dried lentils, coriander seeds, lime juice, large tomato",Indian
1033,"cauliflower rice, minced ginger, full fat coconut milk, onion, salt, coconut oil, curry powder, minced garlic, cilantro leaves, boneless skinless chicken breast",Indian
1034,"bay leaf, cayenne, water, coconut cream, cilantro, small onion, cumin seed, garlic, urad dal, minced ginger, turmeric, salt, basmati rice, kidney beans, Garam Masala, chiles, kasoori methi, ground coriander, coconut oil, water, tomato puree",Indian
1035,"black tea leaves, ground cinnamon, light brown sugar, milk, peppercorns, cloves, cardamom seeds, star anise, ground ginger, water",Indian
1036,"chapati flour, golden raisins, jaggery, sugar, chopped almonds, green cardamom, ghee",Indian
1037,"chopped fresh cilantro, ground cardamom, bay leaf, garlic, phyllo dough, ground coriander, onions, chile peppers, cumin seeds, ground beef, cumin, ground black pepper, chili powder, large potatoes, peas, fresh ginger root, oil, oil, ground cinnamon, ground turmeric, salt",Indian
1038,"red chili pepper, bay leaves, salt, ghee, cream, large garlic cloves, water, vegetable oil, cinnamon sticks, onions, cloves, tomato, cumin seeds, spinach leaves, paneer, green cardamom pods, ice water",Indian
1039,"pistachios, saffron, milk, condensed milk, milk powder, nutmeg, sugar, cardamom pods",Indian
1040,"water, saffron strands, sugar, full cream milk, cardamom powder, pistachios, rice, unsalted almonds",Indian
1041,"curry powder, kosher salt, ground turmeric, ground cumin, Garam Masala, green cabbage, cayenne pepper, olive oil",Indian
1042,"Garam Masala, serrano pepper, eggplant, cilantro, gold potatoes, salt, cumin seeds, masala, oil, water",Indian
1043,"asafoetida, capsicum, ginger, green chilies, onions, coriander powder, low fat cream, red chili powder, salt, cumin powder, turmeric powder, paneer, garam masala powder, oil, coriander leaves, tomato, kasuri methi",Indian
1044,"butter, turmeric, heavy whipping cream, garlic, Garam Masala, salt, tomatoes, chopped cilantro, water, cayenne pepper, ginger",Indian
1045,"fresh cilantro, sea salt, ginger, freshly ground black pepper, cauliflower rice, lemon juice, full fat coconut milk, onion, ground coriander, garlic cloves, coconut oil, shrimp, curry powder, turmeric",Indian
1046,"coriander powder, cumin powder, red chili powder, garlic paste, olive oil, salt, turmeric, yogurt, ginger paste, cilantro, paprika, lemon, whole chicken, garam masala",Indian
1047,"chopped cilantro, hare, plain yogurt, minced ginger, ghee, curry paste, curry paste, turmeric, bay leaves, salt, Madras curry powder, minced garlic, Garam Masala, water, tomato puree, white onion",Indian
1048,"cumin seeds, garlic, red chillies, salt, baby spinach, neutral oil, yogurt",Indian
1049,"Garam Masala, tomato, potatoes, coriander, carrot, oil, dried mango powder, flour, onion, ginger, salt, plain flour, salt, green chillies, stuffing, oil",Indian
1050,"green chilies, tomatoes, salt, turmeric, orange, chopped cilantro, cumin seeds, water, ghee",Indian
1051,"cardamom powder, pistachios, yogurt, sucralose, milk, saffron, nutmeg, almonds",Indian
1052,"minced garlic, coconut milk, Garam Masala, coconut sugar, minced ginger, curry powder, cayenne pepper, ground turmeric, lentils, vegetable oil, fresh chopped cilantro, small onion, tomato puree, red curry paste",Indian
1053,"onion, vine tomato, chili powder, jeera, salt, cinnamon, capsicum, rice, coriander powder, ginger garlic paste, cardamoms, paneer, cilantro, oil, cloves, green chilies, turmeric",Indian
1054,"yellow curry powder, fresh lemon juice, salt, loin pork roast, minced garlic, cumin, chopped fresh chives, black pepper, minced garlic, olive oil, salt, English cucumber, yellow curry powder, ground cardamom, lemon juice, ground cumin, ground ginger, Garam Masala, yogurt, olive oil",Indian
1055,"brown sugar, lemon juice, cardamom pods, vinegar, cloves, white wine vinegar, mangoes, garlic, onion, chilli, cinnamon stick, fresh ginger",Indian
1056,"chilli powder, soy sauce, tomato sauce, paneer, garam masala, salt, garlic paste, oil",Indian
1057,"cumin, clarified butter, chili, ginger, salt, rice, green chilies, tomatoes, water, garam masala, chicken, onions, cloves, yogurt, coriander, yellow food coloring",Indian
1058,"coriander powder, tomato, onions, cream, chilli powder, black peppercorns, cinnamon powder, Garam Masala, cloves, anise, bay leaf, salt, green cardamom, minced chicken, ginger garlic paste, black cardamom",Indian
1059,"canola oil, red chili powder, curry, onion, sugar, cloves, salt, cinnamon stick, green cardamom pods",Indian
1060,"salt, curry leaves, ginger, crushed black pepper, turmeric powder, cumin seeds, green chilies, coconut oil, moong dal, mustard seeds, white rice, cashews",Indian
1061,"cumin powder, baking soda, salt, oil, coriander powder, zucchini, water, red chili powder, rice flour, chickpea flour, turmeric",Indian
1062,"garlic cloves, ginger, cayenne, beef sirloin, plain yogurt, curry powder, Garam Masala, salt",Indian
1063,"turmeric, ginger, coriander powder, ghee, chicken, onions, chilli powder, green chilli, yogurt, crushed garlic, tomato, salt, garam masala powder",Indian
1064,"ground coriander seed, salt, ginger root, tomatoes, olive oil, ground cumin, onions, chopped fresh cilantro, mustard seed, water, red lentils, garlic, jalapeno peppers",Indian
1065,"desiccated coconut, khoya, milk, cardamom powder, sugar, pistachio slivers, saffron threads",Indian
1066,"ghee, milk powder, desiccated coconut, Del Monte Pineapple Slices, ground almonds, caster sugar, cardamom powder",Indian
1067,"bay leaves, garlic, salt, kosher salt, plain yogurt, red chili powder, mint leaves, yellow onions, eggs, basmati rice, plain yogurt, milk, Garam Masala, ghee, ginger, cilantro, lemon juice, jalapeno, chopped cilantro, tomatoes, bone-in chicken, saffron, kosher salt, yellow onions, turmeric",Indian
1068,"tomato, ginger garlic paste, oil, Garam Masala, turmeric powder, veggie, onion, puff pastry, salt, coriander leaves, chilli powder, jeera powder",Indian
1069,"aubergines, coriander, cloves, turmeric, cumin seeds, coriander seeds, peanut butter, chilli powder, onions, tamarind paste, oil, ginger, coconut milk",Indian
1070,"whole milk, cinnamon powder, cardamom powder, cloves, cardamom pods, granulated sugar, assam, water, star anise, cinnamon stick, fresh ginger",Indian
1071,"chili oil, mustard seeds, ground turmeric, minced ginger, carrots, coconut oil, ground cloves, cilantro, yellow onion, vegetable broth, basmati rice, salt, water, garlic, moong dal, lemon wedges, cumin seeds, ground black pepper",Indian
1072,"ghee, green chili, cardamom, vegetables, basmati rice, cloves, peppercorns, salt, ginger, cinnamon stick, bay leaf, green cardamoms, star anise",Indian
1073,"salt, turmeric powder, red chillies, mustard seeds, grated coconut, fresh green beans, urad dal, asafetida, oil, curry leaves",Indian
1074,"chicken thighs, cumin powder, coriander powder, ginger, lemon juice, food colour, vegetable oil, chilli powder, yogurt, garam masala powder, chilli powder, salt",Indian
1075,"plain yogurt, olive oil, cayenne pepper, vegetable broth, red lentils, curry powder, onion, swiss chard, garbanzo beans",Indian
1076,"fresno chiles, fennel seeds, ginger, canola oil, coconut milk, thai chiles, cumin seeds, cinnamon, grated nutmeg, lime leaves, chicken drumsticks, coriander seeds, fat, salt, garlic, candlenuts, ground turmeric, shallot, whole cloves, thai chiles, cardamom seeds",Indian
1077,"cumin seeds, rice, asafoetida, chopped tomatoes, chilli powder, turmeric powder, black peppercorns, cloves, finely chopped onions, red chillies, green chillies, salt, ghee, dal, chopped garlic, cinnamon, curry leaves",Indian
1078,"salt, basmati rice, sultanas, olive oil, coriander, ground cardamom, cucumber, carrot, ground turmeric, ground coriander, onion, cinnamon, roasted cashews, brown cardamom pods",Indian
