ID,Ingredients,Cuisine
272,"onion, dried parsley, orange bell pepper, coriander, salt, ground turkey, olive oil spray, olive oil, cinnamon, ginger, red bell pepper, cumin, ground oats, egg",Moroccan
273,"quinoa, garlic, baby spinach, pepper, chicken stock, chickpeas, cinnamon, butternut squash, cumin, onion, salt, coriander, cayenne pepper, fresh ginger, cous cous, lime, quinoa, chopped fresh cilantro, cooked rice, olive oil, cooked rice, allspice",Moroccan
274,"cayenne pepper, low-fat feta cheese, chopped fresh cilantro, chickpeas, olive oil, plum tomatoes, ground cumin, fresh lemon juice, large carrot, green onions, red bell pepper, salt and ground black pepper",Moroccan
275,"kosher salt, flat-leaf parsley, bone-in chicken breast halves, olive oil, chopped fresh cilantro, yellow onion, small potatoes, freshly ground pepper, baby carrots, bone in chicken thighs, lemon wedges, ras el hanout, apricots halved, green olives",Moroccan
276,"cracked black pepper, eggplant, pumpkin, coriander seeds, chicken stock, leaves, lime juice, quinoa, paprika, cumin seeds, olive oil, zucchini, salt, capsicum",Moroccan
277,"canned chickpeas, cinnamon, extra virgin olive oil, diced tomatoes, zucchini, red onion, low sodium vegetable broth, cumin, turmeric, sweet potato, red bell pepper, salt, dried apricots, carrots, cilantro, garlic",Moroccan
278,"ground turmeric, ground ginger, lemon rind, yellow onions, chicken thighs, chicken stock, leaf parsley, ground white pepper, kosher salt, saffron threads, chopped cilantro, unsalted butter, ground coriander, pitted green olives, olive oil",Moroccan
279,"ground coriander, crushed tomatoes, fresh parsley, dried currants, sliced almonds, bay leaf, cinnamon, cumin, honey, garlic, ghee, boneless skinless chicken breasts, salt, red pepper flakes, yellow onion",Moroccan
280,"chicken stock, chicken stock, garlic cloves, red onions, ground cinnamon, ground cumin, smoked paprika, medjool dates, ground ginger, apricots, ground turmeric, couscous, chilli powder, ground coriander, chicken, salt",Moroccan
281,"freshly ground black pepper, kosher salt, plain yogurt, ground cinnamon, ground cumin, ground lamb, red onions, kosher salt, turmeric, fresh lime juice, ground ginger, fresh dill, coarsely ground black pepper, lettuce, fresh tomato, ground cardamom, fresh mint leaves, ground allspice, saffron threads, virgin olive oil, pita bread",Moroccan
282,"garlic cloves, bone-in chicken breasts, onions, ground ginger, lemon, salt, low sodium chicken broth, olive oil, turmeric, green olives, paprika, black pepper, cumin",Moroccan
283,"water, brown sugar, red wine vinegar, salt, diced tomatoes, minced garlic, ground cumin, pepper, smooth peanut butter, onions, tomato paste, cayenne pepper, chili powder",Moroccan
284,"olive oil, whole wheat couscous, chopped tomatoes, ground coriander, onion, chopped cilantro, cinnamon, sweet potato, ground cloves, garlic, green olives, fennel bulb, plain greek yogurt, ground turmeric, vegetable broth, ginger, dried apricots, turnip",Moroccan
285,"ground cinnamon, unsalted butter, ground black pepper, pistachios, preserved lemon, leaf parsley, Israeli couscous, dried apricots",Moroccan
286,"paprika, medium onion, cinnamon, yellow tomatoes, olive oil, soy sauce, chili powder, powdered ginger, garlic, cumin, parsley, summer squash",Moroccan
287,"paprika, crushed red pepper, olive oil, pepper, lemon, cilantro, cinnamon, turmeric, salt, cumin, carrots",Moroccan
288,"cumin, garlic cloves, pepper, ginger, paprika, salt, leaves, lemon juice, paprika, cilantro, turmeric, lamb chops, olive oil, hot pepper",Moroccan
289,"paprika, cinnamon, EVOO, ground ginger, chicken stock, cayenne pepper, chicken breasts, fresh coriander, ground cumin, oil, paprika, ground coriander, toasted walnuts, garlic cloves, sugar, feta cheese, olive oil, salt, salad leaves, couscous, ground coriander, pomegranate arils",Moroccan
290,"puff pastry, carrots, garlic, parsley, olive oil, vegetable stock, egg, lentils, ras el hanout, onions, salt, pepper",Moroccan
291,"cinnamon, chicken broth, fresh mint, pitted green olives, yellow onion, fresh parsley, harissa, chicken breast, cumin, salt, date honey, fresh ginger, pepper, lemon, garlic cloves",Moroccan
292,"vegetable broth, couscous, slivered almonds, golden raisins, dates, unsalted butter, dried apricots, ground cinnamon",Moroccan
293,"orange blossom water, filo pastry, turmeric, cinnamon, chopped parsley, icing sugar, sea salt, boneless chicken thighs, cinnamon, olive oil, garlic cloves, butter, dried dates, orange zest, eggs, chicken stock, ground ginger, freshly ground black pepper, onions, butter, saffron, ground almonds",Moroccan
294,"chopped parsley, olive oil, green peppers, salt, water, pepper, chopped cilantro, red peppers, cumin, garlic",Moroccan
295,"cilantro leaves, freshly ground black pepper, sea salt, lemons, turmeric, cooked quinoa, almonds, ground cumin, curry powder, cauliflower, plain yogurt, coconut oil, chickpeas, onion",Moroccan
296,"sea salt, red pepper flakes, diced tomatoes, basil leaves, cinnamon, saffron, freshly ground black pepper, garlic, lemon, chopped cilantro, cumin, butternut squash, organic vegetable broth, green lentils, chickpeas, white onion, olive oil",Moroccan
297,"Greek yoghurt, olive oil, smoked paprika, lemon rind, dried cranberries, fresh lemon, chickpeas, ground cinnamon, soy sauce, ground cumin, pistachios, baby spinach leaves, chopped parsley, pomegranate molasses, garlic, red onion",Moroccan
298,"canned chickpeas, bone, cayenne pepper, ground coriander, garlic, chicken stock, spice, ground cumin, hot water, butter, bay leaves, couscous, garlic, salt, onion, smoked paprika, minced ginger, minced garlic, ginger, smoked paprika, herbs, green olives, olive oil, tomatoes",Moroccan
299,"olive oil, low sodium vegetable broth, small onion, scallions, curry powder, carrots, slivered almonds, cinnamon, turmeric powder, quinoa, golden raisins",Moroccan
300,"olive oil, sunflower seeds, paprika, ground cumin, salt, toasted pecans, flax seeds, fresh lemon juice, ground cinnamon, minced garlic, carrots, chopped parsley",Moroccan
301,"chicken thighs, butternut squash, ground ginger, ground coriander, golden raisins, ground cinnamon, chicken broth, olive oil, medium onion, ground cumin, lemon wedges, cayenne pepper, pitted kalamata olives, plum tomatoes, chopped cilantro, salt, garlic, garbanzo beans, ground turmeric",Moroccan
302,"fresh parsley, onion, turmeric, lentils, lemon wedges, dried chickpeas, fine egg noodles, unsalted butter, vegetable broth, chopped fresh cilantro, black pepper, celery rib, water, tomatoes, cinnamon",Moroccan
303,"plain flour, lamb stock, olive, leg of lamb, ground ginger, tomato purée, preserved lemon, saffron, parsley, shallots, cinnamon stick, clear honey, medjool dates, coriander seeds, garlic cloves, coriander",Moroccan
304,"pomegranate juice, kosher salt, meat cut, preserved lemon, dates, olive oil, ginger, coriander seeds, onion, cinnamon sticks",Moroccan
305,"red pepper, coarsely ground black pepper, potato, yellow pepper, pumpkin, cumin powder, salt, red chili powder, fresh breadcrumbs, garlic cloves, vegetable oil, coriander powder, mushrooms, chickpeas, tomatoes, zucchini, onion, cilantro, cinnamon powder",Moroccan
306,"coriander seeds, harissa paste, ground cinnamon, boneless chicken thighs, sweet peppers, meyer lemon, kosher salt, cumin seeds, olive oil, red chiles",Moroccan
307,"extra-virgin olive oil, small onion, ground ginger, chickpeas, raisins, garlic, red pepper flakes, marinara sauce, ground cinnamon, ground turkey, fresh spinach",Moroccan
308,"turmeric, pepper, golden raisins, sliced almonds, ground cinnamon, salt, honey, onion, garlic, minced ginger, yellow bell pepper, bone in chicken thighs, cream, olive oil, lemon, chicken broth, ground coriander, green olives, pearl couscous",Moroccan
309,"paprika, olive oil, apricots halved, tomato juice, ground ginger, garlic, raisins, onions, ground black pepper, ground cinnamon, saffron, turmeric, chicken pieces, flaked almonds, clear honey, oil, chopped tomatoes, chicken stock, preserved lemons, cayenne pepper",Moroccan
310,"ground cumin, fresh mint, chickpeas, smoked paprika, black pepper, sweet potato, onion, tomatoes, ground cinnamon, couscous, aubergine, ground turmeric, yogurt, salt, red bell pepper",Moroccan
311,"red chili powder, cilantro, medium carrots, ground cumin, oranges, lemon juice, ground cinnamon, agave nectar, extra virgin olive oil, pepper",Moroccan
312,"tomatoes, black pepper, olive oil, parsnip, turmeric, water, leek leaves, ginger, sweet potato, cinnamon, beef chuck, brown sugar, cumin, salt, medium carrots",Moroccan
313,"onion, chicken stock, salt, quinoa, fresh cilantro, fresh ginger, pepper, butternut squash, extra virgin olive oil, canned chickpeas, cumin, garlic, cayenne pepper, cooked rice, lime, ground coriander, quinoa, cous cous, cinnamon, cooked rice, allspice, baby spinach",Moroccan
314,"fresh parsley, red onion, tomato paste, dried apricots, red lentils, flaked almonds, lamb shoulder, garlic, ras-al-hanout, beef stock, vegetable oil, harissa paste, marsala, honey",Moroccan
315,"chopped fresh mint, ground cumin, chicken broth, dried apricots, garlic, toasted pine nuts, onion, cinnamon, harissa, cinnamon, tomato paste, fresh lemon juice, turmeric, harissa, medium carrots, ground cumin, olive oil, chicken thighs, kosher salt, honey, fresh ginger, golden raisins",Moroccan
316,"cinnamon, oil, cooked chicken, water, salt, parsley, allspice, onion, prunes, tumeric, diced tomatoes",Moroccan
317,"cinnamon stick, cider vinegar, chopped fresh cilantro, cayenne pepper, chickpeas, freshly ground pepper, kosher salt, olive oil, ground cumin, ground coriander, apricots halved, chicken, diced tomatoes, low sodium chicken broth, yellow onion, garlic cloves",Moroccan
318,"cumin, ground black pepper, turmeric, red pepper flakes, green onions, garlic powder, tomato, English cucumber, light coconut milk, lemon, salt, bell pepper, cinnamon, lime juice, lentils, cilantro",Moroccan
319,"cherry tomatoes, ground tumeric, carrots, tomato paste, zucchini, ground cumin, green olives, onion, salt, bone in chicken thighs, ground cinnamon, cayenne pepper, couscous, ginger powder, ground coriander, dates, garbanzo beans, ginger root, bell pepper, chicken stock",Moroccan
320,"ground cinnamon, garlic, lemon juice, sea salt, carrots, ground cumin, cilantro",Moroccan
321,"butter, dried figs, chicken broth, minced garlic, ground coriander, fresh ginger, ground cumin, chicken, ground cinnamon, salt and ground black pepper, white onion, chopped fresh cilantro",Moroccan
322,"red onion, kale, black pepper, crushed tomatoes, golden raisins, crushed red pepper flakes, chickpeas, garlic, ras el hanout, cinnamon stick, fresh lemon juice, fine sea salt, couscous, unsalted roasted almonds, olive oil, water, plain yogurt",Moroccan
323,"salt, lemon juice, crumbled feta cheese, smoked paprika, honey, pepper, harissa, organic carrots, olive oil, ground cumin, chopped fresh mint",Moroccan
324,"olive oil, chopped cilantro, couscous, ground coriander, raisins, ground cumin, onion, lemon, dried apricots, salt, chickpeas, garlic, slivered almonds, orange juice, ground ginger, pepper, ground cinnamon",Moroccan
325,"tomato paste, bay leaves, dates, bay leaves, ginger, cinnamon, paprika, cumin, couscous, all purpose flour, beef chuck roast, dates, cinnamon, tomato paste, pepper, ginger, dates, beef chuck roast, boiling water, salt, boiling water, garlic, olive oil, chopped parsley, pepper, chicken, paprika, olive, all purpose flour, salt, onion, salt, olive oil, pepper, chopped parsley, dates, garlic, stock, cumin, couscous, salt, onion, olive, pepper",Moroccan
326,"oil, ground cumin, salt, chives, paprika, crushed red pepper flakes, garlic cloves, salt, olive oil, garlic cloves, plain yogurt, bone",Moroccan
327,"ground turmeric, olive oil, medium carrot, golden raisins, no salt added chicken broth, boneless skinless chicken breast halves, fresh lemon juice, couscous, kosher salt, freshly ground black pepper, bay leaf, ground cumin, onion, flat leaf parsley, garlic",Moroccan
328,"lemons juice, chicken breast, celtic salt, fresh tomatoes, cumin powder, coriander powder, turmeric powder, garlic cloves, fresh mint, paprika, harissa (sauce), chicken drumsticks, olive oil",Moroccan
329,"baby carrots, chopped cilantro, olive oil, paprika, chicken thighs, salt, black pepper, green onions, red bell pepper, fresh lemon juice, garlic, Italian parsley, ginger, red pepper flakes, minced garlic, onions, cinnamon, chicken broth, honey",Moroccan
330,"garlic, chickpeas, chicken leg quarters, saffron, dried apricots, cayenne pepper, black pepper, chopped fresh cilantro, honey, couscous, chopped tomatoes, tomato paste, ground cinnamon, onion, ground ginger, carrots, chicken stock, turmeric, ground cumin, salt, ground coriander",Moroccan
331,"fresh lemon juice, kosher salt, extra-virgin olive oil, ground cumin, paprika, lemon peel, ground pepper, lemon zest",Moroccan
332,"cumin, cumin, turnips, cooked rice, cooked rice, carrots, tomato paste, carrots, turnips, chopped cilantro, small yellow onion, olive oil, kosher salt, chickpeas, kosher salt, tomato paste, olive oil, cayenne pepper, freshly ground black pepper, chickpeas, small yellow onion, chicken broth, cayenne pepper, low sodium chicken broth, freshly ground black pepper, chopped cilantro",Moroccan
333,"almonds, raisins, parsley, cinnamon, quinoa, turmeric, shallot, puy lentils, ground coriander, carrot, garlic, salt, lemon juice, pepper, paprika, ground ginger, cumin",Moroccan
334,"lemon, ginger, cayenne, cinnamon, small yellow onion, lentils, garlic, turmeric, cumin seeds, fresh lemon juice, paprika, fresh cilantro, fresh parsley, olive oil, salt, tomatoes, water",Moroccan
335,"honey, garlic, ground allspice, olive oil, fresh lemon juice, carrots, raisins, chopped fresh cilantro, red onion",Moroccan
336,"garlic, baby spinach, no salt added diced tomatoes, vegetable stock, chickpeas, cayenne pepper, curry powder, cooked brown rice, ground cumin, lime wedges, fresh parsley, ground ginger, butternut squash, paprika, chopped onion",Moroccan
337,"cayenne, ground coriander, boiling water, butter, rice, salt, skinless chicken breasts, onion, ground cinnamon, black pepper, ground cloves, ground cumin, ground allspice, seasoning, parsley, ground ginger, chickpeas, apricots halved",Moroccan
338,"olive oil, chickpeas, mint leaves, ginger, dates, salt, onion, garlic, paprika powder, cinnamon powder, cumin powder, tomato puree, coriander powder",Moroccan
339,"dried plums, ground cumin, garlic, chopped fresh cilantro, salt, ground ginger, Progresso Chicken Broth, diced tomatoes, medium onion, couscous, vegetable oil, green olives, ground turmeric, lemon, cinnamon stick, whole chicken",Moroccan
340,"kosher salt, flat leaf parsley, carrots, dried mint, preserved lemon, zucchini, aleppo pepper, cinnamon, tomato paste, extra virgin olive oil, chickpeas, ras el hanout, lemon, ground cumin",Moroccan
341,"chicken legs, dried oregano, ground cumin, turmeric, sea salt, extra-virgin olive oil, ground black pepper, lemons, cayenne pepper, ground ginger, paprika",Moroccan
342,"lemon juice, cilantro, cooked chickpeas, squash, couscous, cumin, sea salt, diced tomatoes, garlic, water, Tahini, cinnamon, medium onion, ginger, cayenne pepper, dates",Moroccan
343,"ground cumin, fresh mint, all purpose flour, olive oil, lamb shoulder chops, green olives, lemon, freshly ground pepper, yellow onion, salt, fat, paprika, beef broth",Moroccan
344,"chopped parsley, fresh cilantro, cinnamon, ground ginger, garlic cloves, lemon, preserved lemons, red onions, olive oil, pitted kalamata olives, chicken thighs, saffron",Moroccan
345,"ground beef, cumin, salt, fresh parsley, paprika, cinnamon, chopped fresh cilantro, mint leaves, cayenne pepper, medium onion, pepper, beef",Moroccan
346,"diced tomatoes, beef, apricots, garlic, ground turmeric, sweet potatoes, red pepper flakes, fresh mint leaves, sea salt, ground cinnamon, olive oil, yellow onion, dried chickpeas, lemon, beef broth",Moroccan
347,"sturgeon fillets, fresh rosemary, crushed red pepper, olive oil, white peppercorns, fennel seeds, cucumber, olive oil, chopped fresh mint, chickpeas, walnuts, flatbreads, raisins, capers, cumin seeds, red bell peppers, cilantro leaves, fresh parsley leaves, fresh lemon juice, garlic cloves",Moroccan
348,"olive oil, ground turmeric, carrots, kosher salt, couscous, skinless boneless chicken thighs, dates, currants, lemon juice, chicken stock, onion, ground cumin, freshly ground pepper, ground cinnamon, ground cardamom",Moroccan
349,"tomato paste, olive oil, eggs, canned tomatoes, harissa paste, onion, chives, salt",Moroccan
350,"fresh lime juice, salt, paprika, chickpeas, ground cumin, vegetable stock, cilantro, coconut oil, fine sea salt, carrots, leeks, minced ginger, garlic, coconut oil, harissa, garlic powder, pepper",Moroccan
351,"top sirloin, kosher salt, extra-virgin olive oil, allspice, ground cumin, ground nutmeg, red bell pepper, ground cloves, purple onion, red wine vinegar, ground black pepper, garlic, turmeric, ground cinnamon",Moroccan
352,"fresh flat leaf parsley, vegetable broth, fresh cilantro, ground coriander, pepper, ground cumin, crushed tomatoes, carrot, celery stalk, sweet paprika, extra-virgin olive oil, red pepper flakes, red lentils, sea salt, onion, ground cinnamon, lemon, garlic cloves, ground turmeric",Moroccan
353,"cilantro, tomatoes, onion, carrots, sea salt, garlic cloves, water, hot chilis, paprika, raisins, olive oil, clove, ground cumin, olive oil, celery, lentils, ground ginger",Moroccan
354,"apple, Tuscan kale, oil, golden raisins, sea salt, ground turmeric, medium carrot, ground cumin, black pepper, lemon, raw almonds, extra-virgin olive oil",Moroccan
355,"cooking spray, olive oil, chopped fresh cilantro, golden raisins, dried apricots, ground cumin, ground cinnamon, ground turmeric, chicken, pistachios, red skin potatoes, honey, garlic cloves, red onions",Moroccan
356,"turnips, carrots, raisins, preserved lemon, tomato, fronds, florets, fennel bulbs, chickpeas, onions, yukon gold potatoes, sea salt, vegetables",Moroccan
357,"harissa, ground coriander, salt, celery, ground cumin, red onion, carrots, black pepper, ground turkey, mayonnaise, olive oil, harissa",Moroccan
358,"sweet paprika, celery, cilantro leaves, red lentils, minced ginger, dates, yellow onion, chickpeas, aleppo pepper, carrot, minced garlic, plum tomatoes, ground turmeric, low salt chicken broth, parsley leaves, lemon wedges, ground cinnamon, coarse salt, extra-virgin olive oil",Moroccan
359,"parsley, sea salt, olive oil, mint, sweet onion, eggplant, organic vegetable stock, zucchinis, fresh mint, carrots, chopped parsley, black pepper, sweet potatoes, ras el hanout, fresh ginger root, cauliflower, harissa, garlic, turmeric",Moroccan
360,"apple cider vinegar, sea salt, water, onion, garlic, sweet paprika, ground turmeric, red bell pepper, tomato paste, ground ginger, coconut sugar, cayenne pepper, green lentils, ground coriander, chopped parsley, ground cumin",Moroccan
361,"onion, chopped cilantro, chicken stock, garlic, cinnamon sticks, ground cumin, tomatoes, dried tart cherries, ptitim, butternut squash, ground coriander, olive oil, crushed red pepper, salt, chickpeas, preserved lemon",Moroccan
362,"labneh, boneless skinless chicken, crushed red pepper, chopped tomatoes, lemon, pita bread, extra virgin olive oil, ground turmeric, coarse kosher salt, fresh mint leaves, Plain Whole Milk Greek Yogurt, lemon, freshly ground black pepper, tomato paste, garlic cloves, red wine vinegar",Moroccan
363,"whole cloves, cayenne pepper, cumin, ground coriander, ground cinnamon, ground ginger, ground allspice, sweet paprika",Moroccan
364,"wheat berries, red peppers, pomegranate seeds, olive oil, kale, pistachios, lemon juice, honey, dried cranberries, ras-al-hanout",Moroccan
365,"vegetable broth, ground cinnamon, chopped parsley, ground coriander, ground turmeric, lemon, red lentils, garlic, ground ginger, crushed tomatoes, smoked paprika, carrots, ground black pepper, sea salt, onions, chopped cilantro, ground cumin",Moroccan
366,"preserved lemon, onion, onion, turmeric, salt, olive oil, garlic, cilantro sprigs, chicken, nigella seeds, white pepper, ginger, saffron threads, cinnamon stick, nigella seeds, water",Moroccan
367,"chickpeas, fresh ginger, sea salt, extra-virgin olive oil, onion, turmeric, chicken stock, cumin, sea salt, tomato paste, lentils, freshly ground black pepper, cilantro, cinnamon, minced garlic, rice",Moroccan
368,"granulated garlic, cauliflower, cilantro, turmeric, fresh lemon juice, extra-virgin olive oil, sea salt, cinnamon, ground thyme, ground ginger",Moroccan
369,"sea salt, lemon juice, olive oil, garlic, parsley, mint, cucumbers, olive oil, chopped onion, chili powder, turmeric, cayenne, cilantro, cinnamon, couscous, fire-roasted diced tomatoes, pita wedges, yogurt, chickpeas",Moroccan
370,"fresh parsley, cayenne powder, green onions, ginger, sugar, paprika, cinnamon, salt, fresh tomatoes, passata, garlic cloves, olive oil, medium onion, chopped fresh cilantro, cumin, turmeric, cooked chickpeas, water",Moroccan
371,"whole wheat couscous, onion, table salt, chopped parsley, cumin, skinless boneless chicken, crushed tomatoes, cayenne pepper, ground cinnamon, baby carrot, butternut squash, vegetable broth, chickpeas, garlic",Moroccan
372,"onions, saffron, ground cumin, freshly ground pepper, lemons, garlic, ground turmeric, ground coriander, salt, olive oil, ginger, green olives, chicken legs, coriander leaves",Moroccan
373,"salt, broth, tomato, onion, turmeric powder, black pepper, cinnamon powder, red lentils, greens, chickpeas, lemon, cumin powder, chopped cilantro, oil, ginger, chili flakes, small carrot",Moroccan
374,"bell pepper, meyer lemon, onion, cilantro, chicken breasts, cinnamon stick, green onions, cumin, cayenne pepper, garlic, chicken stock, black pepper, honey, salt, turmeric, golden raisins",Moroccan
375,"garlic, hungarian sweet paprika, ground turmeric, lemons, onion, bay leaves, ground cumin, extra-virgin olive oil",Moroccan
376,"ground cumin, salt, ground turmeric, paprika, cinnamon, cayenne pepper, sweet potatoes, olive oil, cilantro",Moroccan
377,"russet potato, saffron threads, butternut squash, cinnamon sticks, garlic cloves, kosher salt, onion, ground cumin, vegetable broth, diced fire-roasted tomatoes, chopped fresh cilantro, ground coriander, olive oil, kale, garbanzo beans",Moroccan
378,"extra virgin olive oil, lemon juice, flat leaf parsley, ground black pepper, paprika, fine sea salt, garlic, ground ginger, ground cumin, cauliflower, ground cinnamon",Moroccan
379,"greens, garlic, red pepper flakes, ground cinnamon, fresh mint leaves, tomatoes, orzo, cilantro stems, ground black pepper, olive oil, celery stalks, ground cumin, yellow onion, broth, fresh lemon, fresh parsley leaves, ground coriander, chickpeas, smoked paprika, brown lentils, tomato paste, sea salt",Moroccan
380,"stock, garlic powder, chicken, chicken breast, salt, salt, lemon zest, turmeric, tomato, couscous, chilli powder, capsicum, lemon juice, water, ground cumin, olive oil",Moroccan
381,"lemon, yellow onion, beef broth, ground cumin, freshly ground pepper, lamb shoulder chops, olive oil, fresh mint, paprika, green olives, salt, all purpose flour",Moroccan
382,"fresh parsley, salt, pumpkin, garlic, onions, olive oil, turmeric, cumin, carrots, paprika, fresh parsley, black pepper, chili peppers, green lentils, ginger, tomatoes, chili peppers",Moroccan
383,"garlic, ground turmeric, water, ground cinnamon, onions, pepper, tomatoes, salt, onions, boneless chicken, bell pepper, parsley, ground cumin, lemon juice, paprika, ginger, olive oil",Moroccan
384,"fennel seeds, cayenne pepper, salt, cumin, powdered sugar, black pepper, coriander seeds, cinnamon, sweet paprika",Moroccan
385,"sea salt, Meyer lemon juice, pomegranate seeds, olive oil, cumin, slivered almonds, chopped cilantro, beets",Moroccan
386,"olives, cumin, olive oil, chicken stock, parsley, preserved lemon, chicken legs, garlic, tumeric, butter, ginger powder, red onion, cilantro, black pepper, saffron",Moroccan
387,"chickpeas, kosher salt, ground cumin, lemon juice, carrot, red kidney beans, chopped fresh mint, fresh parsley, ground cinnamon, extra virgin olive oil, garlic",Moroccan
388,"prunes, lamb loin chops, spice blend, salt, ground black pepper, extra-virgin olive oil, honey",Moroccan
389,"salt and ground black pepper, ground ginger, ground coriander, ground turmeric, paprika, olive oil, cayenne pepper, ground cloves, allspice, ground cinnamon, rack of lamb, ground cumin",Moroccan
390,"slivered almonds, ground cinnamon, fresh lemon juice, grated orange rind, ground cinnamon, powdered sugar, pitted dates, orange",Moroccan
391,"fresh spinach, ground coriander, vegetable broth, chopped fresh cilantro, tomato paste, carrots, lemon juice, ground cinnamon, cauliflower, onions, ground pepper, ground turmeric, virgin olive oil, ground cumin, water, garlic, diced tomatoes, lentils",Moroccan
392,"onion, juice, chopped parsley, bay leaf, pitted green olives, black pepper, plum tomatoes, ground cumin, salt, ground cinnamon, chicken broth, apricots, prunes, chicken legs, tomato paste, garlic, olive oil",Moroccan
393,"cilantro, all purpose flour, celery, salt, onion, vermicelli, water, lemon wedges, chickpeas, pepper, dates, tomato paste, parsley, juice, dried figs, olive oil, canned tomatoes, lemon, ground cinnamon, ground ginger, beef",Moroccan
394,"kosher salt, onions, light brown sugar, ground cinnamon, ground black pepper, brandy, honey, golden raisins, olive oil",Moroccan
395,"ground cinnamon, ground cumin, paprika, onion, olive oil, chicken, Meyer lemons, ground ginger, green olives, low salt chicken broth, garlic cloves",Moroccan
