ID,Ingredients,Cuisine
524,"peanut oil, boneless, skinless chicken breasts, onion, acorn squash, crushed tomatoes, salt, spice blend, coconut milk, red lentils, cinnamon stick, pepper, cumin, tumeric, garlic, chopped fresh mint",Moroccan
525,"butter, preserved lemon, preserved lemon, chicken broth, olive oil, red onion, dates, flat leaf parsley, boneless skinless chicken breast, warm water, fresh flat leaf parsley, moroccan seasoning, lemon juice",Moroccan
526,"cinnamon, green olives, cumin, turmeric, pepper, cardamom, golden raisins, salt, cauliflower, chicken pieces, garlic powder, freshly chopped cilantro, acorn squash, olive oil, mint leaves, paprika, sliced almonds",Moroccan
527,"carrots, paprika, lemon juice, garlic, chopped cilantro, harissa, salt, chili powder, ground cumin",Moroccan
528,"tomato, mint, carrots, scallions, ground cinnamon, meat loaf mixture, paprika, olive oil, ground cumin",Moroccan
529,"salt, coconut palm sugar, unsweetened vanilla almond milk, ground cloves, cream, ground coffee, ground cardamom, ground cinnamon, ground ginger, light coconut milk, ground nutmeg, coffee, ground cinnamon",Moroccan
530,"lemons, onion, garlic cloves, olive oil, ground ginger, low sodium chicken broth, kosher salt, ground cinnamon, chicken breasts, ground cumin, paprika, Castelvetrano olives",Moroccan
531,"garlic, onion, canned tomatoes, lamb leg, sliced almonds, pepper, potatoes, prune, salt, fresh cilantro, canned chickpeas, olive oil, couscous, Garam Masala",Moroccan
532,"tomato paste, extra-virgin olive oil, cilantro, low sodium vegetable broth, salt, couscous, ginger, golden raisins, chickpeas, harissa, yams, sweet onion, cinnamon, black pepper, shredded cabbage, chopped garlic, dried apricots, carrots, zucchini",Moroccan
533,"coriander, brown rice, lemon juice, paprika, olive oil, garlic clove, fresh tuna steaks, vegetables",Moroccan
534,"water, marinara sauce, mint leaves, shaved Parmesan, salt, butter, salt, yellow cornmeal, pepper, ground nutmeg, olive oil, green beans, paprika, onion powder, ground white pepper, dried oregano, garlic powder, ground cumin, ground cinnamon, ground coriander, egg, ground beef, salt",Moroccan
535,"fresh mint leaves, garlic, chickpeas, paprika, pepper, salt, ground cumin, carrots, extra-virgin olive oil, cayenne, lemon juice, raisins",Moroccan
536,"salt, ground cardamom, lemon juice, orange juice, extra-virgin olive oil, meat, ground cumin, garlic, honey, ground coriander, grated orange zest, ground cinnamon, grated lemon zest",Moroccan
537,"olive oil spray, honey, cinnamon, olive oil, coriander, carrots, cayenne, kosher salt, lemon",Moroccan
538,"cinnamon, water, cayenne, carrots, coconut milk, potatoes, salt, oil, shallots, cumin, honey, orange juice, veggie, shallots, apple, garlic cloves, onion, ginger",Moroccan
539,"onions, freshly ground black pepper, turmeric, red lentils, paprika, lemon, vegetable broth, extra virgin olive oil, crushed tomatoes, red wine vinegar, flat leaf parsley leaves, garlic, ground coriander, ground cumin, crushed red pepper flakes, kosher salt, allspice, chopped fresh cilantro, cinnamon",Moroccan
540,"lemon juice, watercress, dried apricots, hearts of romaine lettuce, extra virgin olive oil, water, shallot, honey, Garam Masala, pepper, smoked paprika, fresh parsley, salt, ground coriander, toasted almonds, cooked chickpeas, boneless skinless chicken breasts",Moroccan
541,"ground cumin, ground black pepper, ground cinnamon, bone in chicken thighs, seasoned salt, olive oil, dried parsley",Moroccan
542,"raw pistachios, chopped parsley, couscous, lemon juice, dried apricots, harissa, salt, olive oil, red onion",Moroccan
543,"prunes, extra-virgin olive oil, spice, ground black pepper, honey, lamb loin chops, salt",Moroccan
544,"cilantro leaves, raisins, garlic cloves, lamb shanks, olive oil, beef stock, Ras el hanout spice mix, honey, couscous, onions",Moroccan
545,"warm water, water, cooking liquid, chicken cutlets, ground lamb, paprika, red pepper flakes, olive oil, parsley, ground pepper, eggs, turmeric, garlic, cumin, meatball, chicken livers",Moroccan
546,"fresh thyme, salt, lemon, freshly ground pepper, garlic, fresh thyme, unsalted butter, saffron, olives, chopped onion, freshly ground pepper, fresh ginger, salt, extra-virgin olive oil, cilantro leaves, ghee, preserved lemons",Moroccan
547,"salt, pepper, ginger, cumin, cilantro, olive oil, tomato, crushed garlic, beef shoulder, water, frozen green beans, onion, turmeric",Moroccan
548,"olive oil, parsley, roll, saffron, salt, almonds, boneless chicken, turmeric powder, onions, ginger powder, melted butter, cinnamon, chicken stock, black pepper, cilantro, icing sugar, egg",Moroccan
549,"onion, diced tomatoes, Sriracha sauce, lentils, vegetable broth, ground ginger, curry powder, fresh parsley, chicken breast, ground cinnamon, garlic, lemon",Moroccan
550,"lemon juice, finely chopped cilantro, cumin powder, sumac, olive oil, carrot, paprika, salt, garlic",Moroccan
551,"fresh ginger, bay leaf, honey, black peppercorn, nutmeg, chile de arbol, garlic cloves, ground clove, distilled vinegar, preserved lemon, cilantro, ketchup, cinnamon sticks, soy sauce, paprika, cumin",Moroccan
552,"olive oil, honey, ground cumin, chopped fresh cilantro, garlic cloves, cumin seeds, carrot, salt, ground black pepper",Moroccan
553,"turmeric, ground cumin, extra virgin olive oil, green olives, salt, extra virgin olive oil, turmeric, chicken quarters, ground cayenne pepper, butter, lemon, paprika, salt, cilantro leaves, freshly ground black pepper, garlic, sweet onions",Moroccan
554,"harissa, naan, fresh cilantro, olive oil, crushed red pepper, salt, ground lamb, feta cheese, fresh cilantro, red pepper, jalapeño, salted pistachios, apple cider vinegar, cumin, cinnamon, honey, fresh cilantro, garlic, lemon zest, cayenne, cayenne pepper, red onion, apricots",Moroccan
555,"walnuts, onion, tomato paste, brown sugar, flat leaf parsley, chicken stock, lamb shanks, dried figs, Orange, carrots, salt, garlic, olive oil, olive oil, Ras el hanout spice mix, chicken stock, crushed tomatoes, couscous, runny honey, red wine, beetroot",Moroccan
556,"fresh herbs, firm tofu, eggs, toast, moroccan seasoning, low fat natural yoghurt, olive oil, salad, chopped fresh mint, vegetable stock, pistachios, couscous",Moroccan
557,"dried apricots, oil, ground coriander, instant couscous, chicken thigh fillets, ground paprika, cumin seeds, garlic, chickpeas, chicken stock, coriander leaves, onion, Greek style yoghurt, fresh ginger",Moroccan
558,"large carrots, garlic, extra-virgin olive oil, parsley leaves, lemon juice, sesame seeds, ground cinnamon, cayenne, sweet paprika, ground cumin, pepper",Moroccan
559,"ginger, chicken, pepper, tomatoes, puy lentils, chilli powder, vegetable stock, cinnamon powder, canned chickpeas, salt, coriander leaves, flour, onion, vermicelli, oil",Moroccan
560,"baby spinach leaves, cumin, olive oil, large tomato, garlic, eggs, water, chickpeas, smoked paprika, onion, chorizo sausage",Moroccan
561,"salt, ground ginger, tumeric, smoked paprika, ground cinnamon, ground cumin, cayenne pepper, chickpeas",Moroccan
562,"raisins, ground coriander, ground cumin, fresh lemon, fennel seeds, fresh cilantro, turmeric, red onion, nutmeg, paprika, pitted green olives, kosher salt, boneless, skinless chicken thighs, ground allspice, garlic, ground ginger, ground cinnamon",Moroccan
563,"carrots, ground cinnamon, broth, maple syrup, saffron threads, Meyer lemon juice, yellow onion, sea salt, extra-virgin olive oil, red pepper flakes, ground coriander, lemon zest, ground cumin",Moroccan
564,"carrot, cumin, mint, chickpeas, ground coriander, dried apricots, lemon, couscous, lamb, lamb, ground ginger, garlic, onion",Moroccan
565,"ground coriander, ground cumin, aubergine, turmeric, chopped parsley, cooked chickpeas, boiling water, couscous, red pepper, dried cranberries, salt, harissa paste",Moroccan
566,"chopped tomatoes, garlic, spice, eggplant, zucchini, yellow squash, capers, fresh basil leaves, onions, chick peas, tomato paste, golden raisins, black pepper, olive oil, peppers, salt",Moroccan
567,"all purpose flour, ground coriander, ground cumin, chicken broth, garbanzo beans, dried apricots, cayenne pepper, salt, fresh ginger, ground turmeric, pitted green olives, olive oil, skinless boneless chicken breast, couscous, green onions, Orange",Moroccan
568,"garlic cloves, sweet potato, ground coriander, ground cumin, lemon rind, chilli powder, vegetable stock, brown onion, carrots, chickpeas, olive oil",Moroccan
569,"red pepper flakes, cinnamon, cardamom, cumin, salt, coriander, chickpeas, artichoke hearts, paprika, vegetable broth, turmeric, garlic, petite diced tomatoes, onion, ginger, cardamom, pitted kalamata olives",Moroccan
570,"couscous, pepper, salt, garlic, chopped cilantro, bell pepper, canned chickpeas, vegan cheese, zucchini, dried oregano, lemon juice, olive oil",Moroccan
571,"ground walnuts, cocoa powder, orange blossom water, cinnamon, salt, water, sugar, dates",Moroccan
572,"ground cinnamon, bulgur wheat, onions, parsley, freshly ground black pepper, saffron, salt, mint, chicken, chicken stock, tomatoes, parsley, ground turmeric, butter, ras el hanout, coriander, lemon juice, garlic cloves, extra virgin olive oil, dates, preserved lemon, cinnamon sticks, root ginger, red onion, freshly ground black pepper, honey, salt",Moroccan
573,"turmeric powder, olive oil, ground cumin, white onion, water, raisins, arugula, ground cinnamon, chili powder, Lean Cuisine Roasted Turkey Breast",Moroccan
574,"diced tomatoes, large garlic cloves, turmeric, blanched almonds, hungarian sweet paprika, ground cumin, chopped fresh cilantro, fresh lemon juice, ground coriander, ground ginger, chicken drumsticks, kosher salt, eggplant, ground black pepper, olive oil, fresh marjoram, water, fennel seeds, onions, chicken thighs",Moroccan
575,"freshly ground pepper, parsley, extra-virgin olive oil, ground cardamom, ground cinnamon, sweet paprika, ground lamb, salt, ground coriander, garlic powder, ground cumin, nutmeg, mint",Moroccan
576,"black beans, kale leaves, garlic, Himalayan salt, kidney beans, chicken broth, olive oil, ras el hanout, mini sweet peppers, fire roasted tomatoes, garbanzo beans, red onion",Moroccan
577,"garlic cloves, cinnamon, olive oil, ground ginger, butter, cinnamon, butter, icing sugar, ground almonds, sea salt, boneless chicken thighs, orange blossom water, turmeric, chopped parsley, orange zest, onions, chicken stock, eggs, saffron, freshly ground black pepper, dried dates",Moroccan
578,"kosher salt, chicken broth, green olives, fresh flat leaf parsley, lamb stew meat, sweet paprika, bay leaf, olive oil, yellow onion, ground ginger, freshly ground pepper, saffron threads, lemon, garlic cloves, ground cumin",Moroccan
579,"fresh lemon juice, paprika, black pepper, carrot, ground cumin, extra-virgin olive oil, table salt, ground cinnamon, fresh parsley, harissa, cayenne pepper, garlic clove",Moroccan
580,"black olives, scallions, garlic cloves, olive oil, cilantro, mint, white wine vinegar, lemon, bell peppers, potatoes, cucumber",Moroccan
581,"coriander seeds, baby eggplants, cilantro, kosher salt, distilled white vinegar, large garlic cloves, sugar, water, olive oil",Moroccan
582,"boneless, skinless chicken breasts, olive oil, pepper, chicken broth, medium carrots, tumeric, curry, garlic, ground cumin, fresh parsley, chickpeas, onion, celery, diced tomatoes, tomato paste, salt",Moroccan
583,"chickpeas, jalapeño pepper, ginger, water, red onion, white onion, fresh lemon juice, plum tomatoes, garlic cloves, ground turmeric, chopped cilantro, linguine pasta, vegetable stock, medium carrot, kosher salt, canola oil, freshly ground black pepper, celery leaves, ground cumin, freekeh",Moroccan
584,"paprika powder, cumin powder, saffron, pepper, garlic cloves, salt, whole chicken, lemon juice, black pepper, olive oil",Moroccan
585,"chopped tomatoes, dried apricots, pitted prunes, garlic cloves, ground coriander, chickpeas, butternut squash, water, zucchini, yellow onion, Ancho chilies, ground turmeric, ground cinnamon, ground cumin",Moroccan
586,"dried apricots, garlic cloves, ground cumin, chopped onion, honey, roast, tomato paste, lower sodium beef broth, ground red pepper, cooking spray, kosher salt, ground cinnamon",Moroccan
587,"olive oil, garlic, cous cous, chilli powder, olives, paprika, coriander, sea salt, cinnamon, turmeric, stock, chicken, ground pepper, pepper",Moroccan
588,"low sodium vegetable stock, tomato passata, ground cumin, fresh coriander, couscous, fresh parsley, white onions, ground ginger, sweet potato, pomegranate seeds, ground turmeric, garlic, chickpeas, boiling water, ground cinnamon, bay leaf, red lentils, celery",Moroccan
589,"red lentils, smoked paprika, ginger, salt, white onion, turmeric, butternut squash, cooked quinoa, arugula, cinnamon, vegetable broth, chickpeas, red bell pepper, tomato sauce, coconut, cumin, garlic cloves",Moroccan
590,"ground cumin, salt, chilli flakes, ground cinnamon, smoked paprika, carrots, tomato paste, ground black pepper, pumpkin, olive oil, fresh ginger, onion, celery, tomatoes, water, fresh coriander, saffron, ground coriander, puy lentils, turmeric, garlic",Moroccan
591,"ground coriander, ground cinnamon, couscous, fresh mint, boneless, skinless chicken breasts, pomegranate seeds, pistachios, lemon slices, carrots, freshly ground pepper, ground turmeric, red pepper flakes, chickpeas, lemon, coarse kosher salt, cilantro, red onion, ground cumin, extra-virgin olive oil",Moroccan
592,"ground ginger, olives, chopped parsley, large potatoes, garlic clove, turmeric, cooking oil, water, chickpeas, salt, onion, chicken drumsticks, cinnamon, pepper, chopped coriander",Moroccan
593,"aubergine, salt, honey, red bell pepper, harissa paste, apricots halved, butternut squash, ground cumin, ground cinnamon, garlic, flaked almonds, lemon, vegetable stock, harissa paste, vegetable stock, tomato purée, chopped tomatoes, ground coriander, large carrots, pepper, olive oil, fresh mint, red onion, couscous, courgette, chickpeas, pepper, salt, turmeric, yellow bell pepper",Moroccan
594,"eggplant, ground cumin, sea salt, olive oil, garlic, fresh lemon, smoked paprika, sea salt, brown rice, quinoa, white rice, brown rice, yellow onion, olive, maple syrup, chickpeas, water, diced fire roasted tomatoes, harissa paste, cilantro, white rice",Moroccan
595,"butter, onion, beef, water, pepper, saffron threads, preserved lemon, ginger, turmeric, olive oil, garlic, chopped parsley, green olives, salt",Moroccan
596,"garlic, cayenne, cilantro, cumin, brown sugar, cinnamon, peanuts, peanut butter, onion, red wine vinegar, coriander, crushed tomatoes, vegetable broth, chili powder",Moroccan
597,"cinnamon stick, cloves, star anise, water, black peppercorns, kosher salt, lemons",Moroccan
598,"fresh lemon juice, ground coriander, maple syrup, fresh cilantro, pepper, chopped onion, ground allspice, red lentils, smoked paprika, salt, chicken broth, ground cinnamon, carrots, cumin, ground cumin, harissa, low fat plain greek yogurt, butter",Moroccan
599,"chili pepper, cumin, pepper, cinnamon, carrots, salt, chopped cilantro, olive oil, fresh orange juice, brown sugar",Moroccan
600,"coriander, olive oil, vegetable stock, tomatoes, spice, cumin, butternut squash, ground ginger, pepper, cinnamon, large onion, chickpeas, tomato puree, prunes, paprika, garlic cloves, salt, black olives, chilli pepper, stewing beef",Moroccan
601,"sea salt, chevre, avocado, large carrots, coconut oil, ground cumin, cooked brown rice, garlic, Italian seasoning, dried oregano, burger buns, sea salt, sprouts, fresh ginger, butter lettuce, fresh parsley, ground coriander, fresh basil, sweet potato, ground turmeric, red beet, allspice, ground cinnamon",Moroccan
602,"paprika, diced tomatoes, toasted sliced almonds, cumin, yellow onion, bell peppers, salt, butter, sumac, lemon curd, lemon juice, harissa, garlic, pepper, zucchinni, coriander, parsley",Moroccan
603,"blanched almonds, cinnamon, ground ginger, onions, filo, skinless chicken thighs, butter, egg yolk, sugar, vegetable oil, salt, pepper, ground cinnamon, chopped cilantro",Moroccan
604,"salt, pepper, onion, thyme sprigs, courgette, olive oil, carrots, paprika, ground cinnamon, ground cumin, large potatoes, cauliflower",Moroccan
605,"onion, fire-roasted diced tomatoes, extra-virgin olive oil, kosher salt, cilantro stems, crusty bread, ras el hanout, merguez sausage, extra-large eggs, smoked paprika, large garlic cloves, harissa",Moroccan
606,"kosher salt, large eggs, harissa, flat leaf parsley, medium tomato, extra virgin olive oil, steel cut oats, kosher salt, garlic, ground black pepper",Moroccan
607,"ground coriander seed, cinnamon, ground cumin, olive oil, ground cardamom, lemon juice, ginger, black pepper, kosher salt, smoked paprika, minced garlic, ground nutmeg, boneless skinless chicken breasts, turmeric",Moroccan
608,"phyllo dough, ground black pepper, butter, saffron, ground cumin, olive oil, ground cinnamon, reduced sodium chicken broth, garlic cloves, turmeric, large eggs, ground cinnamon, gingerroot, salt, confectioners sugar, slivered almonds, onions, ground red pepper, chicken breasts, sugar, ground cinnamon, coriander leaves, ground coriander",Moroccan
609,"pistachios, boneless skinless chicken breasts, ginger, garlic, diced onion, chicken broth, ground coriander, cinnamon, vegetable oil, honey, chicken broth, ground cinnamon, orange juice, turmeric, rice",Moroccan
610,"ground cumin, kosher salt, ground ginger, saffron threads, hand, chopped parsley, juice, yellow onion, ground black pepper, bay leaf, ground lamb, olive oil, kalamata olives, whole peeled tomatoes, garlic, eggs, unsalted butter, paprika, crushed red chile flakes",Moroccan
611,"cumin, fresh cilantro, Dijon mustard, black pepper, flat leaf parsley, paprika, salt, boneless lamb, red wine vinegar, pita bread, fresh mint, medium tomatoes, olive oil, salt, ground black pepper, olive oil, onions",Moroccan
612,"bone in skin on chicken thighs, dried apricots, red onion, ground coriander, ground cumin, ground ginger, paprika, cilantro, kosher salt, cayenne pepper, ground turmeric, small red potatoes, golden raisins, pistachios, garlic, fresh lemon juice, olive oil",Moroccan
613,"saffron powder, chicken stock, black pepper, chicken, red chilli, lemon juice, cumin powder, sweet paprika, onions, cracked green olives, chopped parsley, garlic cloves, ginger",Moroccan
614,"prunes, cinammon, honey, pepper, couscous, lamb, salt, chicken stock, fresh parsley, ras el hanout, olive oil, onion, blanched almonds",Moroccan
615,"chopped parsley, turmeric, whole almonds, chicken broth, yellow onions, chickpeas, kosher salt, ground white pepper, ginger, cinnamon stick, chicken, butter, fresh lemon juice",Moroccan
616,"paprika, chickpeas, vegetable broth, diced fire roasted tomatoes, ground ginger, white onion, olive oil, salt, red potatoes, minced garlic, saffron threads",Moroccan
617,"pepper, carrots, ground cinnamon, salt, olive oil, paprika, honey, crumbled feta, garlic, cumin seeds, lemon juice, mint leaves",Moroccan
618,"olive oil, cracked green olives, saffron threads, fresh lemon juice, large garlic cloves, chopped fresh cilantro, ground cumin, ground turmeric, chicken broth, ground ginger, bone in chicken thighs, leaf parsley, salt, yellow onions, preserved lemons",Moroccan
619,"freshly ground black pepper, minced garlic, chopped fresh mint, coconut water, ground cumin, lemon juice, onion powder, oregano, lemon, kosher salt, cumin, ground lamb, chopped fresh mint, chopped fresh cilantro, salt, curry powder, allspice, coconut cream, fresh thyme, paprika, chopped fresh cilantro, ground coriander",Moroccan
620,"chickpeas, chili flakes, crushed tomatoes, pepper, yellow pepper, coconut oil, garlic, ground cinnamon, extra-virgin olive oil, dates, greens, cooked brown rice, medium carrots, grated lemon zest, salt, ground coriander, onion, ground cumin, vegetable stock, flat leaf parsley, sweet potatoes",Moroccan
621,"ground cinnamon, cilantro, quinoa, fennel bulb, carrots, toasted almond slices, golden raisins, ground pepper, garlic, black pepper, sea salt, salad, paprika, sea salt, water, fresh parsley, fresh lemon juice",Moroccan
622,"minced garlic, butternut squash, lamb stew meat, red pepper flakes, chopped parsley, onion, peeled fresh ginger, water, ground cinnamon, olive oil, diced tomatoes, ground coriander",Moroccan
623,"salt, fresh parsley, pepper, lemon, olives, boneless skinless chicken breast, spice mix, yellow squash, olive oil, onion",Moroccan
624,"pepper, spinach leaves, quinoa, ground ginger, fennel, salt, apple cider vinegar, extra virgin olive oil, cayenne pepper, chickpeas, white onion, paprika, lemon juice, petite diced tomatoes, cumin, carrots, sweet potatoes, ground cinnamon, fresh cilantro, vegetable stock concentrate, yellow bell pepper, minced garlic, water, curry paste",Moroccan
625,"ras el hanout, chicken breast tenders, honey, red onion, red bell pepper, salt, pineapple juice, garlic, olive oil, apple cider vinegar, fresh pineapple chunks",Moroccan
626,"ground black pepper, ground allspice, ground cumin, cayenne pepper, ground ginger, ground cinnamon, olive oil, ground coriander, sweet paprika, carrots, chile powder, ground cloves, salt",Moroccan
627,"salt, cilantro, raisins, cinnamon, quinoa, garlic, lemon, zucchini, mint leaves, olive oil, eggplant, avocados, spring onions, almonds",Moroccan
628,"honey, vegetable oil, barley grits, flour, semolina, warm water, whole wheat flour, yeast, white flour, cornmeal, salt",Moroccan
629,"turmeric, saffron threads, water, yellow onions, cinnamon, paprika, garlic, ground ginger, preserved lemon, olive oil, chicken breasts, lemon, water, salt, ground white pepper, fresh lemon juice, ground cumin, green olives, fresh parsley",Moroccan
630,"ground ginger, diced tomatoes, zucchini, cumin, green olives, pepper, sweet potatoes, bell pepper, extra-virgin olive oil, turmeric, yellow onion, carrots, salt, garlic, lemon, fresh parsley, coriander, boneless skinless chicken breasts",Moroccan
631,"ground cloves, ground ginger, salt, garlic, green cardamom pods, coconut oil, turmeric, goat, salt, fresh parsley, cinnamon stick, black pepper, ground cumin, chicken broth, saffron, onion, bay leaves, tomatoes, olive oil, cayenne pepper, fenugreek, onion, honey, ground coriander",Moroccan
632,"fresh ginger, smoked paprika, chopped cilantro, smoked paprika, garlic, olive oil, large carrots, chickpeas, olive oil, pepper, honey, fresh lemon juice, sea salt, cumin, harissa, salmon fillets, salt",Moroccan
633,"olive oil, cayenne pepper, harissa, garlic, plum tomatoes, ground ginger, garlic, olive oil, salt, paprika, celery, black pepper, ground cumin, ground coriander, chuck roast, dried apricots, chipotle peppers, red wine vinegar, ground cumin, onion, salt, beef broth, chili peppers, carrot, ground turmeric, ground coriander, celery leaves, all-purpose flour",Moroccan
634,"couscous, fresh ginger, water, onion, cornstarch, olive oil, parsley, beef broth, green olives, white wine, paprika, lamb shoulder, cumin, chicken stock, garlic",Moroccan
635,"salt, brown sugar, onion, pepper, saffron threads, olive oil, sweet potato, vegetable stock, courgettes, tomatoes, ground coriander, green olives, harissa, carrots, cinnamon stick, garlic cloves, medjool dates, dried apricots, ground ginger",Moroccan
636,"coriander, carrot, chilli pepper, lemon juiced, chopped tomatoes, cumin, chickpeas, cinnamon, oil, coriander, cumin, oil, red pepper, paprika, onion",Moroccan
637,"onion, water, cayenne pepper, green bell pepper, cooked chickpeas, carrots, chicken, tomatoes, garlic, ground allspice, arrowroot flour, raisins, ground cumin, yellow bell pepper, olive oil",Moroccan
638,"Tahini, sugar, cinnamon, quinoa, ground cloves, toast, red wine vinegar, couscous, whole wheat pita, ground cumin, ground coriander, bulgur wheat, crushed red pepper flakes, low sodium vegetable broth, chickpeas, garlic, yellow onion, brown rice, olive oil, plum tomatoes",Moroccan
639,"whole wheat couscous, unsalted peanut butter, ground cumin, water, tomatoes, boneless, skinless chicken thighs, golden raisins, paprika, ground cinnamon, red onion, brown rice, quinoa, kosher salt, chickpeas, brown rice, tomato paste, bell peppers, quinoa",Moroccan
640,"lemon slices, tomatoes, fresh lemon juice, ground ginger, paprika, ground cinnamon, honey, onion, chopped fresh cilantro, juice, chicken broth, olive oil, fresh parsley, ground cumin",Moroccan
641,"chicken broth, chopped fresh cilantro, sliced almonds, cayenne pepper, orange slices, cinnamon, mandarin oranges, yellow bell pepper, red bell pepper, golden raisins, red onion, olive oil, garbanzo beans, ground cloves, couscous, oranges, chopped fresh mint, kosher salt, ground cumin, freshly ground black pepper, large garlic cloves, ground ginger, turmeric",Moroccan
642,"pumpkin, lemons, beaten egg, shortcrust pastry, oil, seasoning mix, onions, lamb shoulder, beef stock, cumin seeds, frozen puff pastry, coriander, garlic",Moroccan
643,"salt, red onion, orange juice, mango, cooking spray, chopped fresh mint, harissa, salmon fillet",Moroccan
644,"chicken leg quarters, water, olives, sweet mini peppers, pesto, pepper, chardonnay, salsa, buttermilk, coconut oil, harissa, sea salt",Moroccan
645,"fresh chopped cilantro, green olives, white rice, lemon, ground ginger, butter oil, chicken broth, turmeric, boneless, skinless chicken breast, cumin, lemon, coarse sea salt, paprika, fresh thyme, garlic powder",Moroccan
646,"ground coriander, unsalted butter, extra virgin olive oil, boiling water, sea salt, freshly ground black pepper, large garlic cloves, green olives, homemade chicken stock, bone in chicken thighs, fresh cilantro, ground ginger, preserved lemons, saffron threads, onion",Moroccan
